32758015,Endoscopy After Surgery In Inflammatory Bowel Disease: Crohn'S Disease Recurrence And Pouch Surveillance.,"INTRODUCTION: Crohn's disease (CD) and ulcerative colitis (UC) are immune-mediated disorders characterized by a chronic inflammation, with intermittent exacerbations of symptoms and inflammation. In both diseases, medical treatment has made revolutionary steps forward. Nevertheless, surgery is still required in many cases due to inefficacy of multiple medical therapies. It is not clear whether surgery rates in inflammatory bowel diseases (IBD) are currently decreasing despite all improvements.
AREAS COVERED: Multidisciplinary management is critical in surgical patients to improve long-term outcomes. Endoscopy plays a crucial role, both before and after surgery, in planning therapeutic strategies and stratifying risk of recurrence. Aim of this review is to provide a deeper insight into the central role of endoscopy in the postoperative management of IBD patients, focusing on recent research advances, future challenges and unresolved questions.
EXPERT OPINION: Both UC and CD surgical patients need endoscopy to define the correct therapeutic choice, predict subsequent disease course and adopt the correct surveillance strategy. In the next future, newer endoscopic techniques could be systematically applied in IBD patients after surgery, to assess early postoperative inflammation, response to treatment, or, regarding UC, to provide enhanced pouch surveillance, allowing for early detection of inflammation and dysplasia.",Vespa E; Furfaro F; Allocca M; Fiorino G; Correale C; Gilardi D; Argollo M; Zilli A; Zacharopoulou E; Loy L; Danese S,2020,Expert review of gastroenterology & hepatology,14,9,829-841,10.1080/17474124.2020.1807325,"Vespa, E., Furfaro, F., Allocca, M., Fiorino, G., Correale, C., Gilardi, D., Argollo, M., Zilli, A., Zacharopoulou, E., Loy, L., & Danese, S. (2020). Endoscopy after surgery in inflammatory bowel disease: Crohn's disease recurrence and pouch surveillance.. Expert review of gastroenterology & hepatology, 14(9), 829-841. https://doi.org/10.1080/17474124.2020.1807325",https://pubmed.ncbi.nlm.nih.gov/32758015/,"['Journal Article', 'Review']","['IBD', 'UC', 'CD']",True
33553076,The Oral Microbiome In Pediatric Ibd: A Source Of Pathobionts Or Biomarkers?,"The oral cavity is continuous with the gastrointestinal tract and in children, oral health may be closely linked with the overall health of the GI tract. In the case of pediatric Crohn's disease (CD), oral manifestations are an important clinical indicator of intestinal disease. Recent studies of the microbiome in IBD suggest that translocation of oral microbes to the gut may be a common feature of the microbial dysbiosis which is a signature of both CD and ulcerative colitis (UC). Murine studies suggest that translocation of oral bacteria and yeasts to the lower GI tract may trigger inflammation in susceptible hosts, providing a mechanistic link to the development of IBD. Conversely, some studies have shown that dysbiosis of the oral microbiome may occur, possibly as a result of inflammatory responses and could represent a useful source of biomarkers of GI health. This review summarizes our current knowledge of the oral microbiome in IBD and presents current hypotheses on the potential role of this community in the pathogenesis of these diseases.",Elmaghrawy K; Hussey S; Moran GP,2020,Frontiers in pediatrics,8,,620254,10.3389/fped.2020.620254,"Elmaghrawy, K., Hussey, S., & Moran, G. P. (2020). The Oral Microbiome in Pediatric IBD: A Source of Pathobionts or Biomarkers?. Frontiers in pediatrics, 8, 620254. https://doi.org/10.3389/fped.2020.620254",https://pubmed.ncbi.nlm.nih.gov/33553076/,"['Journal Article', 'Review']","['IBD', 'UC', 'CD']",True
36672491,Therapeutic Management Of Adults With Inflammatory Bowel Disease And Malignancies: A Clinical Challenge.,"Patients with chronic inflammatory bowel diseases (IBD) have increased risk of developing intestinal and extraintestinal cancers. However, once a diagnosis of malignancy is made, the therapeutic management of Crohn's disease (CD) and ulcerative colitis (UC) can be challenging as major guidelines suggest discontinuing the ongoing immunosuppressant and biological therapies for at least 2-5 years after the end of cancer treatment. Recently, new molecules such as vedolizumab and ustekinumab have been approved for IBD and limited data exist on the real risk of new or recurrent cancer in IBD patients with prior cancer, exposed to immunosuppressants and biologic agents. Thus, a multidisciplinary approach and case-by-case management is the preferred choice. The primary aim of our review was to summarize the current evidence about the safety of reintroducing an immunosuppressant or biologic agent in patients with a history of malignancy and to compare the different available therapies, including gut-selective agents. The secondary aim was to evaluate the clinical course of the IBD patients under cancer treatment who do not receive any specific immunosuppressant treatment after the diagnosis of cancer.",Ferretti F; Cannatelli R; Maconi G; Ardizzone S,2023,Cancers,15,2,,10.3390/cancers15020542,"Ferretti, F., Cannatelli, R., Maconi, G., & Ardizzone, S. (2023). Therapeutic Management of Adults with Inflammatory Bowel Disease and Malignancies: A Clinical Challenge.. Cancers, 15(2). https://doi.org/10.3390/cancers15020542",https://pubmed.ncbi.nlm.nih.gov/36672491/,"['Journal Article', 'Review']","['IBD', 'UC', 'CD']",True
38314171,Is The Mediterranean Diet In Inflammatory Bowel Diseases Ready For Prime Time?,"BACKGROUND: The rising incidence of inflammatory bowel diseases (IBD), including Crohn's disease (CD) and ulcerative colitis (UC), specifically in the developing world, suggests an important environmental effect. Amongst environmental influences, dietary factors, particularly the adoption of a westernized diet, have been specifically noticed. In contrast, the Mediterranean diet (MED), characterized by high intake of fruits, vegetables, whole grains, legumes, nuts, olive oil, and moderate consumption of animal and ultra processed foods, has shown potential positive effects in IBD.
METHODS: Here we conducted a narrative review focusing on the evidence regarding the role of MED in IBD prevention and management.
RESULTS: Epidemiological studies suggest inverse association of MED with CD development. Furthermore, adherence to MED has been associated with clinical improvement in active CD and maintenance of lower levels of inflammatory markers in UC, along with improved quality of life and lower mortality rates in IBD patients. Mechanistically, MED promotes a diverse and beneficial gut microbiota, possesses anti-inflammatory properties through polyphenols and dietary fats, and may modulate oxidative stress. In clinical practice, MED may be adapted to diverse disease phenotypes and cultural preferences, and is a sustainable, easy to maintain dietary approach.
CONCLUSION: Current evidence may support the integration of MED into clinical practice in IBD care. In future research, the efficacy of MED in specific IBD phenotypes should be assessed.",Godny L; Dotan I,2024,Journal of the Canadian Association of Gastroenterology,7,1,97-103,10.1093/jcag/gwad041,"Godny, L., & Dotan, I. (2024). Is the Mediterranean Diet in Inflammatory Bowel Diseases Ready for Prime Time?. Journal of the Canadian Association of Gastroenterology, 7(1), 97-103. https://doi.org/10.1093/jcag/gwad041",https://pubmed.ncbi.nlm.nih.gov/38314171/,"['Journal Article', 'Review']","['IBD', 'UC', 'CD']",True
33634430,Increased Risk Of Infections With Anti-Tnf Agents In Patients With Crohn'S Disease After Elective Surgery: Meta-Analysis.,"BACKGROUND: Postoperative complication rates in patients with inflammatory bowel disease (IBD) receiving preoperative biologics have been analyzed without considering the surgical context. Emergency surgery may be associated with an increased risk of infectious complications, compared to elective operations.
AIMS: To conduct a systematic review and meta-analysis investigating the relationship between preoperative biologic therapy and postoperative outcomes in Crohn's disease (CD) and ulcerative colitis (UC), focusing on elective surgery.
METHODS: Electronic databases were searched up to February 12, 2020, for studies of patients with IBD undergoing elective abdominal surgery receiving biologic therapy within 3 months before surgery compared to no therapy, or another biologic therapy. Certainty of evidence was evaluated using GRADE. The primary outcomes were the rate of infections and total complications within 30 days. Pooled odds ratios (ORs) and 95% confidence intervals (CIs) were calculated.
RESULTS: Thirty-three studies were included. Preoperative treatment with anti-tumor necrosis factor (TNF) therapy in patients with CD undergoing elective surgery was associated with increased odds of infection (OR 2.05; 95% CI 1.40-3.01), but not total complications (OR 1.03; 95% CI 0.71-1.51). In elective surgery for UC, preoperative anti-TNF therapy was not associated with infectious (OR 1.03; 95% CI 0.34-3.07) or total complications (OR 0.67; 95% CI 0.29-1.58). Limited data indicate that emergency surgery did not significantly affect the rate of complications.
CONCLUSIONS: Anti-TNF therapy prior to elective surgery may increase the odds of postoperative infection in CD, although the certainty of evidence is very low. More evidence is needed, particularly for newer biologics.",Hanzel J; Almradi A; Istl AC; Yang ML; Fleshner KA; Parker CE; Guizzetti L; Ma C; Singh S; Jairath V,2022,Digestive diseases and sciences,67,2,646-660,10.1007/s10620-021-06895-6,"Hanzel, J., Almradi, A., Istl, A. C., Yang, M. L., Fleshner, K. A., Parker, C. E., Guizzetti, L., Ma, C., Singh, S., & Jairath, V. (2022). Increased Risk of Infections with Anti-TNF Agents in Patients with Crohn's Disease After Elective Surgery: Meta-Analysis.. Digestive diseases and sciences, 67(2), 646-660. https://doi.org/10.1007/s10620-021-06895-6",https://pubmed.ncbi.nlm.nih.gov/33634430/,"['Journal Article', 'Meta-Analysis', 'Systematic Review']","['IBD', 'UC', 'CD']",True
35456656,Plant-Derived Exosomes As A Drug-Delivery Approach For The Treatment Of Inflammatory Bowel Disease And Colitis-Associated Cancer.,"Inflammatory bowel disease (IBD) is a chronic recurrent intestinal disease and includes Crohn's disease (CD) and ulcerative colitis (UC). Due to the complex etiology of colitis, the current treatments of IBD are quite limited and are mainly concentrated on the remission of the disease. In addition, the side effects of conventional drugs on the body cannot be ignored. IBD also has a certain relationship with colitis-associated cancer (CAC), and inflammatory cells can produce a large number of tumor-promoting cytokines to promote tumor progression. In recent years, exosomes from plants have been found to have the ability to load drugs to target the intestine and have great potential for the treatment of intestinal diseases. This plant-derived exosome-targeting delivery system can load chemical or nucleic acid drugs and deliver them to intestinal inflammatory sites stably and efficiently. This review summarizes the pathophysiological characteristics of IBD and CAC as well as the application and prospect of plant exosomes in the treatment of IBD and CAC.",Cai Y; Zhang L; Zhang Y; Lu R,2022,Pharmaceutics,14,4,,10.3390/pharmaceutics14040822,"Cai, Y., Zhang, L., Zhang, Y., & Lu, R. (2022). Plant-Derived Exosomes as a Drug-Delivery Approach for the Treatment of Inflammatory Bowel Disease and Colitis-Associated Cancer.. Pharmaceutics, 14(4). https://doi.org/10.3390/pharmaceutics14040822",https://pubmed.ncbi.nlm.nih.gov/35456656/,"['Journal Article', 'Review']","['IBD', 'UC', 'CD']",True
32424656,Update On Therapeutic Management Of Spondyloarthritis Associated With Inflammatory Bowel Disease.,"Management of spondyloarthritis (SpA) in patients with inflammatory bowel disease (IBD) remains a challenging task that requires multidisciplinary collaboration. Separate guidelines for each disease are well-established. However, the management of SpA co-occurring with Crohn's disease (CD) or ulcerative colitis (UC) has hardly been studied. There are few specific reports that focus on this therapeutic area. The main issue is that some therapeutic options used to treat one disease can negatively influence the other disease course. This study aims to evaluate the therapeutic alternatives that would allow for the appropriate management of patients with both SpA and IBD. Key Points • Collaboration between gastroenterologists and rheumatologists is recommended to improve the management of patients with spondyloarthritis (SpA) and inflammatory bowel disease (IBD). • When treating SpA occurring simultaneously with IBD, it would be appropriate to give priority to the active disease. • Considering its well-proven efficacy in both conditions, anti-tumor necrosis factor (TNF) therapy remains the corner stone in the treatment of these patients. • Other therapeutic options such as Janus kinases (JAK) inhibitors, interleukin (IL)-23 and IL-12 inhibitors, and vedolizumab are still under investigation.",Ben Nessib D; Ferjani H; Maatallah K; Rahmouni S; Kaffel D; Hamdi W,2020,Clinical rheumatology,39,12,3543-3553,10.1007/s10067-020-05136-x,"Ben Nessib, D., Ferjani, H., Maatallah, K., Rahmouni, S., Kaffel, D., & Hamdi, W. (2020). Update on therapeutic management of spondyloarthritis associated with inflammatory bowel disease.. Clinical rheumatology, 39(12), 3543-3553. https://doi.org/10.1007/s10067-020-05136-x",https://pubmed.ncbi.nlm.nih.gov/32424656/,"['Journal Article', 'Review']","['IBD', 'UC', 'CD']",True
39274415,Imaging Of Ulcerative Colitis: The Role Of Diffusion-Weighted Magnetic Resonance Imaging.,"Magnetic resonance imaging (MRI) has emerged as a promising and appealing alternative to endoscopy in the objective assessment of patients with inflammatory bowel disease (IBD). Diffusion-weighted imaging (DWI) is a specialized imaging technique that enables the mapping of water molecule diffusion within biological tissues, eliminating the need for intravenous gadolinium contrast injection. It is expanding the capability of traditional MRI sequences in Ulcerative Colitis (UC). Recently, there has been growing interest in the application of intravoxel incoherent motion (IVIM) imaging in the field of IBD. This technique combines diffusion and perfusion information, making it a valuable tool for assessing IBD treatment response. Previous studies have extensively studied the use of DWI techniques for evaluating the severity of activity in IBD. However, the majority of these studies have primarily focused on Crohn's disease (CD), with only a limited number of reports specifically examining UC. Therefore, this review briefly introduces the basics of DWI and IVIM imaging and conducts a review of relevant studies that have investigated its application in UC to show whether these techniques are useful techniques for evaluating patients with UC in terms of detection, characterization, and quantification of disease activity. Through the extensive literature survey, most of these studies indicate that DWI proves valuable in the differential diagnosis of UC and could be used as an effective modality for staging UC.",Alyami AS,2024,Journal of clinical medicine,13,17,,10.3390/jcm13175204,"Alyami, A. S. (2024). Imaging of Ulcerative Colitis: The Role of Diffusion-Weighted Magnetic Resonance Imaging.. Journal of clinical medicine, 13(17). https://doi.org/10.3390/jcm13175204",https://pubmed.ncbi.nlm.nih.gov/39274415/,"['Journal Article', 'Review']","['IBD', 'UC', 'CD']",True
36145514,"Under The Umbrella Of Clinical Pharmacology: Inflammatory Bowel Disease, Infliximab And Adalimumab, And A Bridge To An Era Of Biosimilars.","Monoclonal antibodies (MAbs) have revolutionized the treatment of many chronic inflammatory diseases, including inflammatory bowel disease (IBD). IBD is a term that comprises two quite similar, yet distinctive, disorders-Crohn's disease (CD) and ulcerative colitis (UC). Two blockbuster MAbs, infliximab (IFX) and adalimumab (ADL), transformed the pharmacological approach of treating CD and UC. However, due to the complex interplay of pharmacology and immunology, MAbs face challenges related to their immunogenicity, effectiveness, and safety. To ease the burden of IBD and other severe diseases, biosimilars have emerged as a cost-effective alternative to an originator product. According to the current knowledge, biosimilars of IFX and ADL in IBD patients are shown to be as safe and effective as their originators. The future of biosimilars, in general, is promising due to the potential of making the health care system more sustainable. However, their use is accompanied by misconceptions regarding their effectiveness and safety, as well as by controversy regarding their interchangeability. Hence, until a scientific consensus is achieved, scientific data on the long-term effectiveness and safety of biosimilars are needed.",Petric Z; Goncalves J; Paixao P,2022,Pharmaceutics,14,9,,10.3390/pharmaceutics14091766,"Petric, Z., Goncalves, J., & Paixao, P. (2022). Under the Umbrella of Clinical Pharmacology: Inflammatory Bowel Disease, Infliximab and Adalimumab, and a Bridge to an Era of Biosimilars.. Pharmaceutics, 14(9). https://doi.org/10.3390/pharmaceutics14091766",https://pubmed.ncbi.nlm.nih.gov/36145514/,"['Journal Article', 'Review']","['IBD', 'UC', 'CD']",True
39039672,Maximizing Treatment Options For Ibd Through Drug Repurposing.,"Chronic inflammation characterizes Inflammatory Bowel Disease (IBD), encompassing Crohn's Disease (CD) and Ulcerative Colitis (UC). Despite modest activity of disease in most UC patients, exacerbations occur, especially in those with severe symptoms, necessitating interventions, like colectomy. Current treatments for IBD, predominantly small molecule therapies, impose significant economic burdens. Drug repurposing offers a cost-effective alternative, leveraging existing drugs for novel therapeutic applications. This approach capitalizes on shared molecular pathways across diseases, accelerating therapeutic discovery while minimizing costs and risks. This article provides an overview of IBD and explores drug repurposing as a promising avenue for more effective and affordable treatments. Through computational and animal studies, potential drug candidates are categorized, offering insights into IBD pathogenesis and treatment strategies.",Barjasteh AH; Al-Asady AM; Latifi H; Al Okla S; Al-Nazwani N; Avan A; Khazaei M; Ryzhikov M; Nadi-Yazdi H; Hassanian SM,2024,Current pharmaceutical design,30,32,2538-2549,10.2174/0113816128318032240702045822,"Barjasteh, A. H., Al-Asady, A. M., Latifi, H., Al Okla, S., Al-Nazwani, N., Avan, A., Khazaei, M., Ryzhikov, M., Nadi-Yazdi, H., & Hassanian, S. M. (2024). Maximizing Treatment Options for IBD through Drug Repurposing.. Current pharmaceutical design, 30(32), 2538-2549. https://doi.org/10.2174/0113816128318032240702045822",https://pubmed.ncbi.nlm.nih.gov/39039672/,"['Journal Article', 'Review']","['IBD', 'UC', 'CD']",True
35740264,Health Benefits Of Dietary Fiber For The Management Of Inflammatory Bowel Disease.,"Crohn's disease (CD) and ulcerative colitis (UC), two components of inflammatory bowel disease (IBD), are painful conditions that affect children and adults. Despite substantial research, there is no permanent cure for IBD, and patients face an increased risk of colon cancer. Dietary fiber's health advantages have been thoroughly investigated, and it is recommended for its enormous health benefits. This review article discusses the importance of appropriate fiber intake in managing IBD, emphasizing how optimal fiber consumption can significantly help IBD patients.",Yusuf K; Saha S; Umar S,2022,Biomedicines,10,6,,10.3390/biomedicines10061242,"Yusuf, K., Saha, S., & Umar, S. (2022). Health Benefits of Dietary Fiber for the Management of Inflammatory Bowel Disease.. Biomedicines, 10(6). https://doi.org/10.3390/biomedicines10061242",https://pubmed.ncbi.nlm.nih.gov/35740264/,"['Journal Article', 'Review']","['IBD', 'UC', 'CD']",True
39339221,Advancements In Inflammatory Bowel Disease Management: From Traditional Treatments To Monoclonal Antibodies And Future Drug Delivery Systems.,"Inflammatory bowel disease (IBD) is a chronic gastrointestinal inflammatory disorder with two main subtypes: ulcerative colitis (UC) and Crohn's disease (CD). The pathogenesis involves genetic predisposition, dysbiosis, and immune dysregulation. Complications include perianal lesions, strictures, fistulas, perforations, and an increased risk of colon cancer. Clinical classification ranges from mild to fulminant and recurrent disease, with common symptoms such as abdominal discomfort, rectal bleeding, diarrhea, and weight loss. Extraintestinal manifestations include arthritis, erythema nodosum, pyoderma gangrenosum, and uveitis. Conventional treatments using aminosalicylates, corticosteroids, and immunomodulators have limitations. Biologics, introduced in the 1990s, offer improved efficacy and specificity, targeting factors like TNF-α, integrins, and cytokines. Monoclonal antibodies play a crucial role in IBD management, aiming to reduce relapses, hospitalizations, and surgeries. In conclusion, this review is aimed at summarizing the latest knowledge, advantages, and drawbacks of IBD therapies, such as small molecules, biologics, and monoclonal antibodies, to provide a basis for further research in the IBD field.",Di Rienzo A; Marinelli L; Dimmito MP; Toto EC; Di Stefano A; Cacciatore I,2024,Pharmaceutics,16,9,,10.3390/pharmaceutics16091185,"Di Rienzo, A., Marinelli, L., Dimmito, M. P., Toto, E. C., Di Stefano, A., & Cacciatore, I. (2024). Advancements in Inflammatory Bowel Disease Management: From Traditional Treatments to Monoclonal Antibodies and Future Drug Delivery Systems.. Pharmaceutics, 16(9). https://doi.org/10.3390/pharmaceutics16091185",https://pubmed.ncbi.nlm.nih.gov/39339221/,"['Journal Article', 'Review']","['IBD', 'UC', 'CD']",True
34449288,Anti-Integrin Drugs In Clinical Trials For Inflammatory Bowel Disease (Ibd): Insights Into Promising Agents.,"INTRODUCTION: Despite huge and increasing developments in the treatment of inflammatory bowel disease (IBD), a significant percentage of patients with Crohn's disease (CD) and ulcerative colitis (UC) is still in need of an effective and safe therapeutic option. Tackling the trafficking of leukocytes specifically within or directed to the inflamed gut appears to be a particularly promising strategy, and several new anti-integrin agents are currently under investigation in clinical trials.
AREAS COVERED: This review summarizes efficacy and safety data from phase 1, 2 and 3 clinical trials on investigational drugs, including monoclonal antibodies (etrolizumab, abrilumab, ontamalimab) and oral small molecules (AJM300, PTG-100). It also discusses the future perspectives for the treatment of IBD patients with this class of agents.
EXPERT OPINION: The pipeline of anti-integrin agents is well assorted, and it is reasonable to expect that some will be introduced in the market soon. Among the most exciting features of this class are the gut selectivity, the convenient subcutaneous and oral administrations and the reassuring safety profiles. Most of the new anti-integrins seem to improve outcomes in UC but not in CD, however these data are far from definitive and several pivotal trials are still under way.",Solitano V; Parigi TL; Ragaini E; Danese S,2021,Expert opinion on investigational drugs,30,10,1037-1046,10.1080/13543784.2021.1974396,"Solitano, V., Parigi, T. L., Ragaini, E., & Danese, S. (2021). Anti-integrin drugs in clinical trials for inflammatory bowel disease (IBD): insights into promising agents.. Expert opinion on investigational drugs, 30(10), 1037-1046. https://doi.org/10.1080/13543784.2021.1974396",https://pubmed.ncbi.nlm.nih.gov/34449288/,"['Journal Article', 'Review']","['IBD', 'UC', 'CD']",True
39867090,Infliximab Precision Dosing In Inflammatory Bowel Disease (Ibd) Patients: A Review Of Current Literature.,"The therapeutic failure of infliximab therapy remains a challenge in patients with inflammatory bowel disease (IBD), and dose optimization is often required. Accelerated or intensified regimes showed value in treating patients in the acute setting with high CRP or low albumin levels, which are suggested by recent guidelines; however, evidence is weak. Therapeutic drug monitoring (TDM), with anti-tumor necrosis factor-alpha (TNF-α) trough levels and antibodies, showed value during maintenance therapy, but not in induction and can guide clinical decisions in patients that might be undertreated with the standard dosing regimen. Combining the impact of therapeutic drug monitoring with a Bayesian forecasting methodology to calculate drug clearance can help on calculating the optimal infliximab dose for patients with ulcerative colitis (UC) and Crohn's disease (CD) on both the induction and maintenance phase. This will help to identify those who need intensification of their current regime to boost the therapeutic effect and those who are non-responders. This review aims to summarize the recent literature regarding infliximab precision dosing in IBD patients using forecasting methodology.",Toskas A; Manti M; Kamperidis N; Arebi N,2024,Cureus,16,12,e76424,10.7759/cureus.76424,"Toskas, A., Manti, M., Kamperidis, N., & Arebi, N. (2024). Infliximab Precision Dosing in Inflammatory Bowel Disease (IBD) Patients: A Review of Current Literature.. Cureus, 16(12), e76424. https://doi.org/10.7759/cureus.76424",https://pubmed.ncbi.nlm.nih.gov/39867090/,"['Journal Article', 'Review']","['IBD', 'UC', 'CD']",True
