40786606,"Anaerobic Gut Bacteria And Their Potential Role In The Initiation, Exacerbation, And Development Of Human Colorectal Cancer: A Narrative Review.","Colorectal cancer (CRC) is known as the second leading cause of cancer-related deaths around the world. Rectal bleeding, changes in bowel movements, weight loss, and fatigue are the main clinical presentations of CRC. While the exact etiology of the disease is unknown, CRC is considered a complex and multifactorial disease resulted from an intricate interplay of genetic and environmental factors. Moreover, CRC is known as a chronic inflammation-associated tumor, and patients with inflammatory bowel disease (IBD) or Irritable bowel syndrome (IBS) are susceptible groups to CRC development. The gut microbiota and its metabolites play a crucial role in the development and progression of CRC. CRC can be created after anaerobic bacterial infections such as Enterotoxigenic Bacteroides fragilis (ETBF), Fusobacterium, Clostridium difficile, Clostridium perfringens, Clostridium septicum, Peptostreptococcus, Prevotella, Veillonella, etc. Activation of Wnt signaling, loss of tissue architecture, proinflammatory signaling, and genotoxic cellular DNA damage are the primary mechanisms by which anaerobic bacteria induce carcinogenesis in CRC. Besides, spore germination and toxin production are done in hypoxic and acidic conditions. Therefore, according to the presence of this condition (anaerobic glycolysis) in tumor tissue, the tumor environment is suitable for the formation of anaerobic infections. The current review-based study aims to discuss the important aspects of these mechanisms and their possible roles in the initiation, development, and exacerbation of CRC.",Sabour S; Sadeghi Koupaei H; Ghasemi H; Amin M; Azimi T,2025,Frontiers in cellular and infection microbiology,15,,1559001,10.3389/fcimb.2025.1559001,"Sabour, S., Sadeghi Koupaei, H., Ghasemi, H., Amin, M., & Azimi, T. (2025). Anaerobic gut bacteria and their potential role in the initiation, exacerbation, and development of human colorectal cancer: a narrative review.. Frontiers in cellular and infection microbiology, 15, 1559001. https://doi.org/10.3389/fcimb.2025.1559001",https://pubmed.ncbi.nlm.nih.gov/40786606/,"['Journal Article', 'Review']","['IBS', 'inflammatory bowel disease']",True
38599319,"Diet, Food, And Nutritional Exposures And Inflammatory Bowel Disease Or Progression Of Disease: An Umbrella Review.","Inflammatory bowel disease (IBD), including Crohn's disease (CD) and ulcerative colitis (UC), contributes to substantial morbidity. Understanding the intricate interplay between dietary factors and the incidence and progression of IBD is essential for developing effective preventative and therapeutic strategies. This umbrella review comprehensively synthesizes evidence from systematic reviews and meta-analyses to evaluate these complex associations. Dietary factors associated with an increased incidence and/or progression of IBD include a high intake of red and processed meat, other processed foods, and refined sugars, together with a low intake of vegetables, fruits, and fiber. For most other food groups, the results are mixed or indicate no clear associations with IBD, CD, and UC. Some differences seem to exist between UC and CD and their risk factors, with increased intake of dietary fiber being inversely associated with CD incidence but not clearly associated with UC. Dietary fiber may contribute to maintaining the gut epithelial barrier and reduce inflammation, often through interactions with the gut microbiota. This seems to play an important role in inflammatory mechanisms in the gut and in IBD incidence and progression. Diets low in fermentable saccharides and polyols can alleviate symptom burden, but there are concerns regarding their impact on the gut microbiota and their nutritional adequacy. Mediterranean diets, vegetarian diets, and a diet low in grains, sugars, and lactose (specific carbohydrate diet) are also associated with lower incidence and/or progression of IBD. The associations of dietary patterns are mirrored by inflammatory biomarkers. IBD is typically treated pharmaceutically; however, many patients have a suboptimal response to medical treatments. The findings from this umbrella review could provide evidence for nutritional counseling and be a valuable addition to traditional treatment plans for IBD. This systematic review was registered at PROSPERO as CRD440252.",Christensen C; Knudsen A; Arnesen EK; Hatlebakk JG; Sletten IS; Fadnes LT,2024,"Advances in nutrition (Bethesda, Md.)",15,5,100219,10.1016/j.advnut.2024.100219,"Christensen, C., Knudsen, A., Arnesen, E. K., Hatlebakk, J. G., Sletten, I. S., & Fadnes, L. T. (2024). Diet, Food, and Nutritional Exposures and Inflammatory Bowel Disease or Progression of Disease: an Umbrella Review.. Advances in nutrition (Bethesda, Md.), 15(5), 100219. https://doi.org/10.1016/j.advnut.2024.100219",https://pubmed.ncbi.nlm.nih.gov/38599319/,"['Journal Article', 'Systematic Review']","['IBD', 'UC', 'CD']",True
37111210,Nutritional Status And Its Detection In Patients With Inflammatory Bowel Diseases.,"Malnutrition is an important issue in patients with inflammatory bowel diseases (IBDs) including Crohn's disease (CD) and ulcerative colitis (UC). It is caused by altered digestion and absorption within the small bowel, inadequate food intake, and drug-nutrient interactions in patients. Malnutrition is an essential problem because it is related to an increased risk of infections and poor prognosis in patients. It is known that malnutrition is also related to an increased risk of postsurgery complications in IBD patients. Basic nutritional screening involves anthropometric parameters with body mass index (BMI) and others (fat mass, waist-to-hip ratio, muscle strength), medical history concerning weight loss, and biochemical parameters (including the Prognostic Nutritional Index). Besides standard nutritional screening tools, including the Subjective Global Assessment (SGA), Nutritional Risk Score 2002 (NRS 2002), and Malnutrition Universal Screening Tool (MUST), specific nutritional screening tools are used in IBD patients, such as the Saskatchewan Inflammatory Bowel Disease-Nutrition Risk Tool (SaskIBD-NR Tool and IBD-specific Nutritional Screening Tool). There is a higher risk of nutrient deficiencies (including iron, zinc, magnesium) and vitamin deficiencies (including folic acid, vitamin B12 and D) in IBD patients. Therefore, regular evaluation of nutritional status is important in IBD patients because many of them are undernourished. An association between plasma ghrelin and leptin and nutritional status in IBD patients has been observed. According to some authors, anti-tumor necrosis factor (anti-TNFα) therapy (infliximab) can improve nutritional status in IBD patients. On the other hand, improvement in nutritional status may increase the response rate to infliximab therapy in CD patients. Optimization of nutritional parameters is necessary to improve results of conservative and surgical treatment and to prevent postoperative complications in patients with IBDs. This review presents basic nutritional screening tools, anthropometric and laboratory parameters, dietary risk factors for IBDs, common nutrient deficiencies, associations between anti-TNFα therapy and nutritional status, selected features regarding the influence of nutritional status, and surgical outcome in IBD patients.",Jabłońska B; Mrowiec S,2023,Nutrients,15,8,,10.3390/nu15081991,"Jabłońska, B., & Mrowiec, S. (2023). Nutritional Status and Its Detection in Patients with Inflammatory Bowel Diseases.. Nutrients, 15(8). https://doi.org/10.3390/nu15081991",https://pubmed.ncbi.nlm.nih.gov/37111210/,"['Journal Article', 'Review']","['IBD', 'UC', 'CD']",True
32023881,Nutritional Aspects In Inflammatory Bowel Diseases.,"Crohn's disease (CD) and ulcerative colitis (UC) are chronic, relapsing, inflammatory disorders of the digestive tract that characteristically develop in adolescence and early adulthood. The reported prevalence of malnutrition in inflammatory bowel disease (IBD) patients ranges between 20% and 85%. Several factors, including reduced oral food intake, malabsorption, chronic blood and proteins loss, and intestinal bacterial overgrowth, contribute to malnutrition in IBD patients. Poor nutritional status, as well as selective malnutrition or sarcopenia, is associated with poor clinical outcomes, response to therapy and, therefore, quality of life. The nutritional assessment should include a dietetic evaluation with the assessment of daily caloric intake and energy expenditure, radiological assessment, and measurement of functional capacity.",Balestrieri P; Ribolsi M; Guarino MPL; Emerenziani S; Altomare A; Cicala M,2020,Nutrients,12,2,,10.3390/nu12020372,"Balestrieri, P., Ribolsi, M., Guarino, M. P. L., Emerenziani, S., Altomare, A., & Cicala, M. (2020). Nutritional Aspects in Inflammatory Bowel Diseases.. Nutrients, 12(2). https://doi.org/10.3390/nu12020372",https://pubmed.ncbi.nlm.nih.gov/32023881/,"['Journal Article', 'Review']","['IBD', 'UC', 'CD']",True
37274062,Study Of Tumor Necrosis Factor Receptor In The Inflammatory Bowel Disease.,"Ulcerative colitis (UC) and Crohn's disease (CD) are part of Inflammatory Bowel Diseases (IBD) and have pathophysiological processes such as bowel necrosis and enteric neurons and enteric glial cells. In addition, the main inflammatory mediator is related to the tumor necrosis factor-alpha (TNF-α). TNF-α is a me-diator of the intestinal inflammatory processes, thus being one of the main cytokines involved in the pathogenesis of IBD, however, its levels, when measured, are present in the serum of patients with IBD. In addition, TNF-α plays an important role in promoting inflammation, such as the production of interleukins (IL), for instance IL-1β and IL-6. There are two receptors for TNF as following: The tumor necrosis factor 1 receptor (TNFR1); and the tumor necrosis factor 2 receptor (TNFR2). They are involved in the pathogenesis of IBD and their receptors have been detected in IBD and their expression is correlated with disease activity. The soluble TNF form binds to the TNFR1 receptor with, and its activation results in a signaling cascade effects such as apoptosis, cell proliferation and cytokine secretion. In contrast, the transmembrane TNF form can bind both to TNFR1 and TNFR2. Recent studies have suggested that TNF-α is one of the main pro-inflammatory cytokines involved in the pathogenesis of IBD, since TNF levels are present in the serum of both patients with UC and CD. Intravenous and subcutaneous biologics targeting TNF-α have revolutionized the treatment of IBD, thus becoming the best available agents to induce and maintain IBD remission. The application of antibodies aimed at neutralizing TNF-α in patients with IBD that induce a satisfactory clinical response in up to 60% of patients, and also induced long-term maintenance of disease remission in most patients. It has been suggested that anti-TNF-α agents inactivate the pro-inflammatory cytokine TNF-α by direct neutralization, i.e., resulting in suppression of inflammation. However, anti-TNF-α antibodies perform more complex functions than a simple blockade.",Souza RF; Caetano MAF; Magalhães HIR; Castelucci P,2023,World journal of gastroenterology,29,18,2733-2746,10.3748/wjg.v29.i18.2733,"Souza, R. F., Caetano, M. A. F., Magalhães, H. I. R., & Castelucci, P. (2023). Study of tumor necrosis factor receptor in the inflammatory bowel disease.. World journal of gastroenterology, 29(18), 2733-2746. https://doi.org/10.3748/wjg.v29.i18.2733",https://pubmed.ncbi.nlm.nih.gov/37274062/,"['Journal Article', 'Review']","['IBD', 'UC', 'CD']",True
38505875,Dietary Therapies For Adult And Pediatric Inflammatory Bowel Disease.,"Diet is an environmental exposure implicated in the development of inflammatory bowel disease (IBD), including Crohn's disease (CD) and ulcerative colitis (UC). Dietary therapy is also a tool for management of these conditions. Nutrition therapy for IBD has been shown to reduce intestinal inflammation, promote healing, and alleviate symptoms, as well as improve patients' nutrition status. Although the mechanisms of action of most nutrition therapies for IBD are not well understood, the diets are theorized to eliminate triggers for gut dysbiosis and mucosal immune dysfunction associated with the typical Western diet. Exclusive enteral nutrition and the Crohn's disease exclusion diet are increasingly being used as the primary treatment modality for the induction of remission and/or maintenance therapy in children, and in some adults, with CD. Several other diets, such as the Mediterranean diet, anti-inflammatory diet for IBD, and diets excluding gluten, FODMAPs (fermentable oligosaccharides, disaccharides, monosaccharides, and polyols), lactose, or other compounds, may be helpful in symptom management in both CD and UC, though evidence for biochemical efficacy is limited. In this review, we discuss the role of diet components in IBD pathogenesis and examine diets currently used in the management of children and adults with IBD. We also address practical, psychosocial, and cultural considerations for dietary therapy across diverse populations.",Deas J; Shah ND; Konijeti GG; Lundin A; Lanser O; Magavi P; Ali S,2024,Nutrition in clinical practice : official publication of the American Society for Parenteral and Enteral Nutrition,39,3,530-545,10.1002/ncp.11146,"Deas, J., Shah, N. D., Konijeti, G. G., Lundin, A., Lanser, O., Magavi, P., & Ali, S. (2024). Dietary therapies for adult and pediatric inflammatory bowel disease.. Nutrition in clinical practice : official publication of the American Society for Parenteral and Enteral Nutrition, 39(3), 530-545. https://doi.org/10.1002/ncp.11146",https://pubmed.ncbi.nlm.nih.gov/38505875/,"['Journal Article', 'Review']","['IBD', 'UC', 'CD']",True
36771373,Current Nutritional Therapies In Inflammatory Bowel Disease: Improving Clinical Remission Rates And Sustainability Of Long-Term Dietary Therapies.,"Inflammatory Bowel Disease (IBD) includes a spectrum of chronic immune-mediated intestinal diseases thought to be related to the complex interaction between the host immune system and the intestinal microbiome. Research supports the use of nutritional therapy in IBD; however, it is not routinely used in clinical practice. This literature review seeks to advance the understanding of diet and its effect in IBD with a focus on both Crohn's Disease (CD) and Ulcerative Colitis (UC). The contribution of diet to the development and treatment of IBD cannot be overstated. In both pediatric as well as adult IBD, nutritional interventions have been shown to improve clinical symptoms as well as inflammatory burden. The impact of dietary intervention is best exemplified through the use of Exclusive Enteral Nutrition (EEN) in CD. EEN and clinical research on exclusionary whole food diets-Crohn's Disease Exclusion Diet (CDED), Specific Carbohydrate Diet (SCD), low fermentable oligosaccharides, disaccharides, monosaccharides and polyols (FODMAP) diet, and Mediterranean Diet-are discussed within this review. Current clinical literature supports the elimination of detrimental components and the incorporation of low processed whole foods in the diet. Additional prospective and longitudinal dietary studies on sustainable and long-term dietary options, along with a deeper understanding of the mechanism, are needed to further advance the role of nutritional interventions in IBD.",Reznikov EA; Suskind DL,2023,Nutrients,15,3,,10.3390/nu15030668,"Reznikov, E. A., & Suskind, D. L. (2023). Current Nutritional Therapies in Inflammatory Bowel Disease: Improving Clinical Remission Rates and Sustainability of Long-Term Dietary Therapies.. Nutrients, 15(3). https://doi.org/10.3390/nu15030668",https://pubmed.ncbi.nlm.nih.gov/36771373/,"['Journal Article', 'Review']","['IBD', 'UC', 'CD']",True
37317532,Efficacy And Safety Of Advanced Oral Small Molecules For Inflammatory Bowel Disease: Systematic Review And Meta-Analysis.,"BACKGROUND AND AIMS: Oral small-molecule drugs [SMDs] are expanding the therapeutic landscape for inflammatory bowel disease [IBD]. This systematic review and meta-analysis summarizes the efficacy and safety of JAK inhibitor [JAKi] and sphingosine-1-phosphate [S1P] receptor modulator treatments for ulcerative colitis [UC] and Crohn's disease [CD].
METHODS: MEDLINE, Embase, and CENTRAL were searched from inception to May 30, 2022. Randomized controlled trials [RCTs] of JAKi and S1P receptor modulators in adults with UC or CD were eligible. Clinical, endoscopic, histological, and safety data were pooled and analysed using a random-effects model.
RESULTS: Thirty-five RCTs [26 UC, nine CD] were included. In UC, JAKi therapy was associated with induction of clinical (risk ratio [RR] 3.16, 95% confidence interval [CI] 2.03-4.92; I2 = 65%) and endoscopic [RR 3.99, 95% CI 2.36-6.75; I2 = 36%] remission compared to placebo. Upadacitinib was associated with histological response [RR 2.63, 95% CI 1.97-3.53]. S1P modulator therapy was associated with induction of clinical [RR 2.52, 95% CI 1.88-3.39; I2 = 1%] and endoscopic [RR 2.39, 95% CI 1.07-5.33; I2 = 0%] remission relative to placebo. Ozanimod was superior to placebo for inducing histological remission in UC [RR 2.20, 95% CI 1.43-3.37; I2 = 0%], while etrasimod was not [RR 2.36, 95% CI 0.71-7.88; I2 = 0%]. In CD, JAKi therapy was superior to placebo for induction of clinical remission [RR 1.53, 95% CI 1.19-1.98; I2 = 31%], and endoscopic remission [RR 4.78, 95% CI 1.63-14.06; I2 = 43%] compared to placebo. The risk of serious infections was similar for oral SMDs and placebo.
CONCLUSION: JAKi and S1P receptor modulator therapies are effective in IBD for inducing clinical and endoscopic remission and, in some circumstances, histological response.",Solitano V; Vuyyuru SK; MacDonald JK; Zayadi A; Parker CE; Narula N; Peyrin-Biroulet L; Danese S; Feagan BG; Singh S; Ma C; Jairath V,2023,Journal of Crohn's & colitis,17,11,1800-1816,10.1093/ecco-jcc/jjad100,"Solitano, V., Vuyyuru, S. K., MacDonald, J. K., Zayadi, A., Parker, C. E., Narula, N., Peyrin-Biroulet, L., Danese, S., Feagan, B. G., Singh, S., Ma, C., & Jairath, V. (2023). Efficacy and Safety of Advanced Oral Small Molecules for Inflammatory Bowel Disease: Systematic Review and Meta-Analysis.. Journal of Crohn's & colitis, 17(11), 1800-1816. https://doi.org/10.1093/ecco-jcc/jjad100",https://pubmed.ncbi.nlm.nih.gov/37317532/,"['Meta-Analysis', 'Systematic Review', 'Journal Article']","['IBD', 'UC', 'CD']",True
37506265,Early Biologic Treatment Decreases Risk Of Surgery In Crohn'S Disease But Not In Ulcerative Colitis: Systematic Review And Meta-Analysis.,"BACKGROUND AND AIMS: Inflammatory bowel disease (IBD) can lead to long-term complications that significantly impact patients' quality of life and healthcare resource utilization. Prior studies have demonstrated improved short-term outcomes to early exposure of biologics in patients with Crohn's disease (CD) but not in patients with ulcerative colitis (UC). However, there are conflicting data on impact of early intervention on longer-term adverse events. Therefore, we conducted a systematic review and meta-analysis assessing the impact of early biologic treatment on rates of IBD-related surgery.
METHODS: A systematic search was conducted in April 2022. Studies were included if biologic initiation was compared between patients starting early (<3 years of diagnosis or top-down treatment) vs later (>3 years of diagnosis or step-up treatment). Studies with <1 year of follow-up were excluded. The outcomes were colectomy and CD-related surgery for patients with UC and CD, respectively. Random-effects analyses were conducted to compare rates of IBD surgery between early and late biologic treatment.
RESULTS: Eighteen studies were included in the meta-analysis. Three studies included patients with UC and 15 studies included patients with CD. In patients with CD, early biologic therapy was associated with lower odds of surgery (odds ratio, 0.63; 95% confidence interval, 0.48-0.84) compared with late treatment. Conversely, in patients with UC, the odds of colectomy were increased (odds ratio, 2.86; 95% confidence interval, 1.30-6.30).
CONCLUSIONS: Early biologic treatment is associated with lower rates of surgery in patients with CD. In contrast, early biologic therapy appears to be associated with higher rates of colectomy in patients with UC, which may be confounded by disease severity.",Law CCY; Tkachuk B; Lieto S; Narula N; Walsh S; Colombel JF; Ungaro RC,2024,Inflammatory bowel diseases,30,7,1080-1086,10.1093/ibd/izad149,"Law, C. C. Y., Tkachuk, B., Lieto, S., Narula, N., Walsh, S., Colombel, J. F., & Ungaro, R. C. (2024). Early Biologic Treatment Decreases Risk of Surgery in Crohn's Disease but not in Ulcerative Colitis: Systematic Review and Meta-Analysis.. Inflammatory bowel diseases, 30(7), 1080-1086. https://doi.org/10.1093/ibd/izad149",https://pubmed.ncbi.nlm.nih.gov/37506265/,"['Systematic Review', 'Journal Article', 'Meta-Analysis', 'Research Support, N.I.H., Extramural']","['IBD', 'UC', 'CD']",True
38665795,Role Of Diet In Prevention Versus Treatment Of Crohn'S Disease And Ulcerative Colitis.,"Diet is a modifiable risk factor for disease course and data over the past decade have emerged to indicate its role in Crohn's disease (CD) and ulcerative colitis (UC). However, literature is riddled with misinterpretation of data, often leading to unexpected or conflicting results. The key understanding is that causative factors in disease development do not always proceed to an opportunity to change disease course, once established. Here, we discuss the data on dietary influences in three distinct disease states for CD and UC-predisease, active disease and quiescent disease. We appraise the literature for how our dietary recommendations should be shaped to prevent disease development and if or how that differs for CD and UC induction therapy and maintenance therapy. In UC, principles of healthy eating are likely to play a role in all states of disease. Conversely, data linking dietary factors to CD prevention and treatment are paradoxical with the highest quality evidence for CD treatment being exclusive enteral nutrition, a lactose, gluten and fibre-free diet comprising solely of ultraprocessed food-all dietary factors that are not associated or inversely associated with CD prevention. High-quality evidence from dietary trials is much awaited to expand our understanding and ultimately lead our dietary recommendations for targeted patient populations.",Halmos EP; Godny L; Vanderstappen J; Sarbagili-Shabat C; Svolos V,2024,Frontline gastroenterology,15,3,247-257,10.1136/flgastro-2023-102417,"Halmos, E. P., Godny, L., Vanderstappen, J., Sarbagili-Shabat, C., & Svolos, V. (2024). Role of diet in prevention versus treatment of Crohn's disease and ulcerative colitis.. Frontline gastroenterology, 15(3), 247-257. https://doi.org/10.1136/flgastro-2023-102417",https://pubmed.ncbi.nlm.nih.gov/38665795/,"['Journal Article', 'Review']","['IBD', 'UC', 'CD']",True
