37682003,Efficacy And Safety Of Hyperbaric Oxygen Therapy In Fistulizing Crohn'S Disease: A Systematic Review And Meta-Analysis.,"BACKGROUND: Hyperbaric oxygen therapy (HBOT) delivers 100% oxygen in a pressurized chamber, increasing tissue oxygen levels and regulating inflammatory pathways. Mounting evidence suggests that HBOT may be effective for inflammatory bowel disease. Our systematic review and meta-analysis aimed to quantify the efficacy and safety of HBOT in fistulizing Crohn's disease (CD).
METHODS: A systematic review was conducted using the EMBASE, Web of Science, Pubmed, and Cochrane Library databases according to the ""Preferred Reporting Items for Systematic Reviews and Meta-analyses"" criteria. Study bias was assessed using the Cochrane Handbook guidelines.
RESULTS: Sixteen studies with 164 patients were included in the analysis. For all fistula subtypes, the pooled overall clinical response was 87% (95% CI: 0.70-0.95, I2 = 0) and the pooled clinical remission was 59% (95% CI: 0.35-0.80, I2 = 0). The overall clinical response was 89%, 84%, and 29% for perianal, enterocutaneous, and rectovaginal fistulas, respectively. On meta-regression, hours in the chamber and the number of HBOT sessions were not found to correlate with clinical response. The pooled number of adverse events was low at 51.7 per 10,000 HBOT sessions for all fistula types (95% CI: 16.8-159.3, I2 = 0). The risk of bias was observed across all studies.
CONCLUSION: HBOT is a safe and potentially effective treatment option for fistulizing CD. Randomized control trials are needed to substantiate the benefit of HBOT in fistulizing CD.",Dokmak A; Sweigart B; Orekondy NS; Jangi S; Weinstock JV; Hamdeh S; Kochar GS; Shen B; Levy AN,2024,Journal of clinical gastroenterology,58,2,120-130,10.1097/MCG.0000000000001905,"Dokmak, A., Sweigart, B., Orekondy, N. S., Jangi, S., Weinstock, J. V., Hamdeh, S., Kochar, G. S., Shen, B., & Levy, A. N. (2024). Efficacy and Safety of Hyperbaric Oxygen Therapy in Fistulizing Crohn's Disease: A Systematic Review and Meta-analysis.. Journal of clinical gastroenterology, 58(2), 120-130. https://doi.org/10.1097/MCG.0000000000001905",https://pubmed.ncbi.nlm.nih.gov/37682003/,"['Meta-Analysis', 'Systematic Review', 'Journal Article']","['IBS', 'inflammatory bowel disease']",True
35509010,The Efficacy Of Vitamin D Supplementation For Irritable Bowel Syndrome: A Systematic Review With Meta-Analysis.,"BACKGROUND: Irritable bowel syndrome (IBS) is a chronic gastrointestinal disorder involving gut-brain interactions with limited effective treatment options. Vitamin D deficiency is commonly observed in patients with IBS, but whether vitamin D supplementation ameliorates IBS is controversial in randomized controlled trials. The present systematic review and meta-analysis explored the efficacy of vitamin D supplementation in patients with IBS.
METHODS: We performed a systematic search of potentially relevant publications from PubMed, EMBASE, the Cochrane Central Register of Controlled Studies and the Web of Science up until January 2022. We assessed the weighted mean difference (WMD) and 95% confidence interval (95% CI) of the IBS severity scoring system (IBS-SSS), IBS quality of life (IBS-QoL) and IBS total score (IBS-TS) before and after vitamin D supplementation intervention.
RESULTS: We included four randomized, placebo-controlled trials involving 335 participants. The differences in IBS-SSS score between participants in the intervention group and the placebo group increased after intervention (WMD: -55.55, 95% CI: -70.22 to -40.87, I2 = 53.7%, after intervention; WMD: -3.17, 95% CI: -18.15 to 11.81, I2 = 0.0%, before intervention). Participants receiving vitamin D supplementation showed greater improvement in IBS-SSS after intervention than participants receiving placebo treatment (WMD: -84.21, 95% CI: -111.38 to -57.05, I2 = 73.2%; WMD: -28.29, 95% CI: -49.95 to -6.62, I2 = 46.6%, respectively). Vitamin D supplementation was also superior to placebo in IBS-QoL improvement (WMD: 14.98, 95% CI: 12.06 to 17.90, I2 = 0.0%; WMD: 6.55, 95% CI: -2.23 to 15.33, I2 = 82.7%, respectively). Sensitivity analyses revealed an unstable pooled effect on IBS-TS in participants receiving vitamin D supplementation. Therefore, we did not evaluate the efficacy of vitamin D intervention in IBS-TS.
CONCLUSIONS: This systematic review and meta-analysis suggested that vitamin D supplementation was superior to placebo for IBS treatment.",Huang H; Lu L; Chen Y; Zeng Y; Xu C,2022,Nutrition journal,21,1,24,10.1186/s12937-022-00777-x,"Huang, H., Lu, L., Chen, Y., Zeng, Y., & Xu, C. (2022). The efficacy of vitamin D supplementation for irritable bowel syndrome: a systematic review with meta-analysis.. Nutrition journal, 21(1), 24. https://doi.org/10.1186/s12937-022-00777-x",https://pubmed.ncbi.nlm.nih.gov/35509010/,"['Journal Article', 'Meta-Analysis', 'Systematic Review', ""Research Support, Non-U.S. Gov't""]","['IBS', 'inflammatory bowel disease']",True
35256335,The Association Between Fusobacterium Nucleatum And Cancer Colorectal: A Systematic Review And Meta-Analysis.,"INTRODUCTION: The etiological factors of colorectal cancer (CRC) are not precisely known, although genetic and environmental factors have been implicated. A possible association with Fusobacterium nucleatum may provide opportunities for an early diagnosis.
OBJECTIVE: To review studies that address the association between F. nucleatum and CRC.
METHODS: The MEDLINE PubMed database was searched using the terms «colorectal cancer» and ""Fusobacterium nucleatum"", retrieving publications published up to January 1 2020. Stata software was used for a meta-analysis.
RESULTS: The systematic review included 57 articles. Meta-analysis results indicated a more frequent presence of F. nucleatum in CRC tumour tissue samples in comparison to control samples of healthy tissue, with an odds ratio of 4.558 (95% CI: 3.312-6.272), and in comparison, to control samples of colorectal adenomas, with an odds ratio of 3.244 (95 % CI: 2.359-4.462).
CONCLUSION: There is a more frequent resence of F. nucleatum in the CRC. However, further studies are needed to verify this relationship.",Villar-Ortega P; Expósito-Ruiz M; Gutiérrez-Soto M; Ruiz-Cabello Jiménez M; Navarro-Marí JM; Gutiérrez-Fernández J,2022,Enfermedades infecciosas y microbiologia clinica (English ed.),40,5,224-234,10.1016/j.eimce.2022.02.007,"Villar-Ortega, P., Expósito-Ruiz, M., Gutiérrez-Soto, M., Ruiz-Cabello Jiménez, M., Navarro-Marí, J. M., & Gutiérrez-Fernández, J. (2022). The association between Fusobacterium nucleatum and cancer colorectal: A systematic review and meta-analysis.. Enfermedades infecciosas y microbiologia clinica (English ed.), 40(5), 224-234. https://doi.org/10.1016/j.eimce.2022.02.007",https://pubmed.ncbi.nlm.nih.gov/35256335/,"['Journal Article', 'Meta-Analysis', 'Systematic Review']","['IBS', 'inflammatory bowel disease']",True
39407084,Efficacy And Safety Of A Low-Fodmap Diet In Combination With A Gluten-Free Diet For Adult Irritable Bowel Syndrome: A Systematic Review And Meta-Analysis.,"BACKGROUND: Common gastrointestinal disease irritable bowel syndrome (IBS) is marked by symptoms like changed bowel habits, bloating, and stomach ache. A low-FODMAP combined gluten-free diet (LF-GFD) has been suggested as a possible therapy for IBS symptoms management.
OBJECTIVE: This study sought to investigate whether a LF-GFD would help patients with IBS.
METHODS: Strict inclusion and exclusion criteria from internet databases helped to identify clinical studies evaluating the intervention of LF-GFD in the treatment of IBS patients. Using measurements including the visual analog scale (VAS) for bloating and pain, the IBS symptom severity scale (IBS-SSS), and IBS quality of life (IBS-QoL), the main results evaluated were the efficacy of LF-GFD in reducing IBS symptoms. Furthermore assessed were the psychological impacts of LF-GFD utilizing the self- rating depression scale (SDS) and self- rating anxiety scale (SAS).
RESULTS: A total of 437 patients (221 on LF-GFD diet and 216 on GFD) were involved in 4 randomized controlled trials and 4 cohort studies. The combined results indicated that LF-GFD reduced the VAS bloating ratings (RR = - 0.58, 95%CI - 0.92-0.23, P = 0.0010, I2 = 83%) and the VAS pain scores (RR = - 0.42, 95%CI - 0.66-0.19, P = 0.005, I2 = 58%). In addition, LF-GFD indicated a substantial enhancement in IBS-SSS scores (MD = - 1.42, 95%CI - 2.74-0.10, P = 0.03, I2 = 24%) and IBS-QoL ratings (MD = 3.75, 95%CI 0.98-6.53, P = 0.008, I2 = 33%). Moreover, the LF-GFD group showed a substantial drop in SDS (MD = - 2.56, 95%CI - 3.38-1.74, P < 0.00001, I2 = 65%) and SAS (MD = - 4.30, 95%CI - 6.53-2.24, P < 0.0001, I2 = 0%) scores compared to the GFD group.
CONCLUSION: LF-GFD therapy significantly enhances clinical symptoms and reduces anxiety and depression in individuals diagnosed with irritable bowel syndrome.",Zhang J; Yu P; Xu Y; Lu XY; Xu Y; Hang J; Zhang Y,2024,Digestive diseases and sciences,69,11,4124-4132,10.1007/s10620-024-08671-8,"Zhang, J., Yu, P., Xu, Y., Lu, X. Y., Xu, Y., Hang, J., & Zhang, Y. (2024). Efficacy and Safety of a Low-FODMAP Diet in Combination with a Gluten-Free Diet for Adult Irritable Bowel Syndrome: A Systematic Review and Meta-Analysis.. Digestive diseases and sciences, 69(11), 4124-4132. https://doi.org/10.1007/s10620-024-08671-8",https://pubmed.ncbi.nlm.nih.gov/39407084/,"['Journal Article', 'Systematic Review', 'Meta-Analysis']","['IBS', 'inflammatory bowel disease']",True
37541185,"Histological Disease Activity As Predictor Of Clinical Relapse, Hospitalization, And Surgery In Inflammatory Bowel Disease: Systematic Review And Meta-Analysis.","BACKGROUND: The clinical impact of histological remission on short- and long-term clinical outcomes in patients with inflammatory bowel disease (IBD) is not well established. We assessed risk of clinical relapse, hospitalization, and need for surgery in patients achieving histological remission in comparison with active histological disease.
METHODS: A systematic review was conducted using MEDLINE, Scopus, Cochrane CENTRAL, EMBASE, and conference abstracts from inception to November 2022. Our main outcome was the rate of clinical relapse in patients with IBD who reached histological remission vs patients with active histological disease. Secondary outcomes were clinical complications of IBD such as hospitalization and need for surgery. The endpoints were investigated at 2 time points, 6 to 12 months (short term) and >12 months (long term).
RESULTS: Short-term outcome analysis showed that the risk of clinical relapse was significantly higher in ulcerative colitis patients with active histological disease in comparison with patients at histological remission (risk ratio [RR], 2.41; 95% confidence interval [CI], 1.69-3.44; P < .01). The risk of hospitalization in ulcerative colitis patients was not significant among the 2 groups (RR, 4.22; 95% CI, 0.91-19.62; P = .07). Long-term outcome analysis demonstrated that the risk of clinical relapse (RR, 2.07; 95% CI, 1.55-2.76; P < .01), need for surgery (RR, 3.14; 95% CI, 1.53-6.45; P < .01), and hospitalization (RR, 2.52; 95% CI, 1.59-4.00; P < .01) was significantly higher in patients with active histological disease.
CONCLUSIONS: Histological remission in IBD represents an important therapeutic goal that is not yet routinely pursued in clinical practice. In our study, patients who achieved histological remission have more favorable outcomes than those with active histological disease in ulcerative colitis.",Shehab M; Al Akram S; Hassan A; Alrashed F; Jairath V; Bessissow T,2024,Inflammatory bowel diseases,30,4,563-572,10.1093/ibd/izad119,"Shehab, M., Al Akram, S., Hassan, A., Alrashed, F., Jairath, V., & Bessissow, T. (2024). Histological Disease Activity as Predictor of Clinical Relapse, Hospitalization, and Surgery in Inflammatory Bowel Disease: Systematic Review and Meta-Analysis.. Inflammatory bowel diseases, 30(4), 563-572. https://doi.org/10.1093/ibd/izad119",https://pubmed.ncbi.nlm.nih.gov/37541185/,"['Meta-Analysis', 'Systematic Review', 'Journal Article']","['IBS', 'inflammatory bowel disease']",True
37836500,Herbal Remedies For Constipation-Predominant Irritable Bowel Syndrome: A Systematic Review Of Randomized Controlled Trials.,"BACKGROUND: Constipation-predominant irritable bowel syndrome (IBS-C) is a common gastrointestinal disorder characterized by abdominal pain and altered bowel habits. Conventional treatments for IBS-C often provide limited efficiency, leading to an increasing interest in exploring herbal remedies. This systematic review aims to evaluate the efficacy and safety of herbal remedies in the management of IBS-C.
MATERIALS AND METHODS: A comprehensive search of PubMed, MEDLINE, Embase, Scopus, and the Cochrane Library was conducted to identify relevant studies published up to July 2023 and data extraction was performed independently by two reviewers.
RESULTS: Overall, the included studies demonstrated some evidence of the beneficial effects of herbal remedies on IBS-C symptoms, including improvements in bowel frequency, stool consistency, abdominal pain, and quality of life. However, the heterogeneity of the interventions and outcome measures limited the ability to perform a meta-analysis.
CONCLUSION: This systematic review suggests that herbal remedies may have potential benefits in the management of IBS-C. However, the quality of evidence is limited, and further well-designed, large-scale RCTs are needed to establish the efficacy and safety of specific herbal remedies for IBS-C. Clinicians should exercise caution when recommending herbal remedies and consider individual patient characteristics and preferences.",Chiarioni G; Popa SL; Ismaiel A; Pop C; Dumitrascu DI; Brata VD; Duse TA; Incze V; Surdea-Blaga T,2023,Nutrients,15,19,,10.3390/nu15194216,"Chiarioni, G., Popa, S. L., Ismaiel, A., Pop, C., Dumitrascu, D. I., Brata, V. D., Duse, T. A., Incze, V., & Surdea-Blaga, T. (2023). Herbal Remedies for Constipation-Predominant Irritable Bowel Syndrome: A Systematic Review of Randomized Controlled Trials.. Nutrients, 15(19). https://doi.org/10.3390/nu15194216",https://pubmed.ncbi.nlm.nih.gov/37836500/,"['Journal Article', 'Systematic Review']","['IBS', 'inflammatory bowel disease']",True
35911986,Effects And Mechanisms Of Acupuncture On Diarrhea-Predominant Irritable Bowel Syndrome: A Systematic Review.,"BACKGROUND: Irritable bowel syndrome (IBS) is a common disorder of gut-brain interaction with challenging treatment. According to evidence-based studies, acupuncture is likely to be a promising therapy and subservient adjunct for IBS. Mechanism study of acupuncture based on related clinical trials of high quality, nevertheless, is still vacant.
AIM: This study aims to assess the results and qualities of current clinical evidence and conclude the relevant pathophysiological mechanisms and therapeutic effects of acupuncture on IBS with diarrhea (IBS-D).
METHODS: Literature from four databases, namely, PubMed, Cochrane Library, EMBASE, and Web of Science, was systematically searched to obtain eligible randomized controlled trials (RCTs), which contained mechanism research of acupuncture treatment in IBS-D patients. Two independent reviewers completed data extraction and quality evaluation using the RevMan 5.4.1 software.
RESULTS: Ten trials that covered 19 items related to mechanism research were included in this review. Acupuncture was reported to improve IBS-D symptoms and quality of life, with positive effects in regulating brain-gut peptides, cerebral activities, neuroendocrine functions, psychological state, and inflammatory GI and hypersensitive intestinal tracts.
CONCLUSION: Acupuncture has potential influence on pathophysiology alterations such as regulating brain-gut peptides, altering cerebral connectivity and activity, promoting neuroendocrine functions and mental state, and mitigating inflammation as well as hypersensitivity of bowels in IBS-D patients, but further studies of high quality are still necessary.
SYSTEMATIC REVIEW REGISTRATION: [https://www.crd.york.ac.uk/PROSPERO], identifier [CRD42022320331].",Zhang G; Zhang T; Cao Z; Tao Z; Wan T; Yao M; Su X; Wei W,2022,Frontiers in neuroscience,16,,918701,10.3389/fnins.2022.918701,"Zhang, G., Zhang, T., Cao, Z., Tao, Z., Wan, T., Yao, M., Su, X., & Wei, W. (2022). Effects and Mechanisms of Acupuncture on Diarrhea-Predominant Irritable Bowel Syndrome: A Systematic Review.. Frontiers in neuroscience, 16, 918701. https://doi.org/10.3389/fnins.2022.918701",https://pubmed.ncbi.nlm.nih.gov/35911986/,"['Systematic Review', 'Journal Article']","['IBS', 'inflammatory bowel disease']",True
39289768,"Clinical Efficacy And Safety Of Faecal Microbiota Transplantation In The Treatment Of Irritable Bowel Syndrome: A Systematic Review, Meta-Analysis And Trial Sequential Analysis.","BACKGROUND: The aim of this study is to evaluate the efficacy and safety of faecal microbiota transplantation (FMT) for the treatment of irritable bowel syndrome (IBS).
METHODS: We searched four databases for randomised controlled trials (RCTs) that compared FMT with a control intervention in patients with IBS. The revised Cochrane risk-of-bias (RoB) tool was chosen for appraisal. Meta-analysis with trial sequential analysis (TSA) was conducted. Grading of Recommendations Assessment Development and Evaluation (GRADE) methodology was used to assess the certainty of evidence (CoE).
RESULTS: We included 12 RCTs with a total of 615 participants. Meta-analyses showed no significant difference between the FMT and control groups in terms of clinical responses (relative risk [RR] = 1.44, 95% confidence interval [CI] 0.88-2.33) and changes in IBS Severity Scoring System (IBS-SSS) scores (standardised mean difference [SMD] = - 0.31, 95% CI - 0.72 to 0.09) and IBS Quality of Life (IBS-QOL) scores (SMD = 0.30, 95% CI - 0.09 to 0.69). Subgroup analysis revealed that in studies with low RoB and using endoscopy, nasojejunal tube and rectal enema delivery, FMT led to a significant improvement in clinical responses and changes in IBS-SSS and IBS-QOL scores. TSA suggested that the current evidence is inconclusive and that the CoE is very low.
CONCLUSION: This study suggests that patients with IBS may benefit from FMT especially when it is administered via endoscopy, nasojejunal tube or rectal enema. However, the certainty of evidence is very low. Further research is needed to confirm the efficacy and safety of FMT for IBS treatment.
TRIAL REGISTRATION: PROSPERO registration number CRD42020211002.",Lo SW; Hung TH; Lin YT; Lee CS; Chen CY; Fang CJ; Lai PC,2024,European journal of medical research,29,1,464,10.1186/s40001-024-02046-5,"Lo, S. W., Hung, T. H., Lin, Y. T., Lee, C. S., Chen, C. Y., Fang, C. J., & Lai, P. C. (2024). Clinical efficacy and safety of faecal microbiota transplantation in the treatment of irritable bowel syndrome: a systematic review, meta-analysis and trial sequential analysis.. European journal of medical research, 29(1), 464. https://doi.org/10.1186/s40001-024-02046-5",https://pubmed.ncbi.nlm.nih.gov/39289768/,"['Journal Article', 'Meta-Analysis', 'Systematic Review']","['IBS', 'inflammatory bowel disease']",True
36443973,Children And Adolescents With Irritable Bowel Syndrome: Treatment And Management.,"BACKGROUND: Irritable bowel syndrome (IBS) is a disorder that causes stomach pain in children and adolescents. It may also impact one's quality of life. IBS is linked to gastrointestinal issues such as diarrhoea and constipation. Despite the identification of several potential pathophysiological pathways, the aetiology of IBS remained unknown.
OBJECTIVE: The aim of this paper is to discuss the diagnosis, pathogenesis, case studies and treatment of Irritable bowel syndrome in children and adolescents.
METHODS: This systematic review covered relevant papers from the previous ten years that were accessible in Science Direct, Elsevier, NCBI, and Web of Science related to the pathophysiology and function of pharmacological drugs such as antidepressants, antispasmodics, prokinetics, and antibiotics in children with irritable bowel syndrome.
RESULTS: Only a few prospective therapy techniques have been investigated in children, and even fewer of those have been demonstrated to be effective. This article presents case studies including 50-59 children, which demonstrate a favourable acceptable impact that is more effective than a placebo in terms of reducing symptoms and improving the overall quality of life in children who have irritable bowel syndrome. Furthermore, the majority of the pathophysiological explanations and treatment options discussed are based on adult studies. These major issues arose when treating paediatric IBS, and they must be addressed in order to properly treat children with IBS. Trials that focus on many combinations of pharmacological and non-pharmacological therapies seem to be more helpful.
DISCUSSION: In recent years, a number of systematic reviews have been conducted to evaluate the efficacy of medication treatments in children for IBS; however, the dependability of these systematic reviews needs to be further investigated owing to the various experimental designs and levels of evidence used. This article highlights paediatric therapy options, including pharmaceutical medications such as antidepressants, antispasmodics, prokinetics, and antibiotics. The goal is to alleviate IBS symptoms while also enhancing the quality of life for children with this illness.",Wal A; Wal P; Verma N; Pandey SS; Krishnan K; Bhowmick M,2024,Current pediatric reviews,20,2,166-177,10.2174/1573396319666221128094843,"Wal, A., Wal, P., Verma, N., Pandey, S. S., Krishnan, K., & Bhowmick, M. (2024). Children and Adolescents with Irritable Bowel Syndrome: Treatment and Management.. Current pediatric reviews, 20(2), 166-177. https://doi.org/10.2174/1573396319666221128094843",https://pubmed.ncbi.nlm.nih.gov/36443973/,"['Journal Article', 'Systematic Review']","['IBS', 'inflammatory bowel disease']",True
40765115,Effects Of A Low Fodmap Diet In Inflammatory Bowel Disease And Patient Experiences: A Mixed Methods Systematic Literature Review And Meta-Analysis.,"INTRODUCTION: A low FODMAP diet reduces symptoms of irritable bowel syndrome (IBS), but its impact on inflammatory bowel disease (IBD) is less established. This systematic review aimed to: (1) assess the effect of a low FODMAP diet in IBD and (2) understand patient experiences when implementing the low FODMAP diet.
METHODS: Four databases (Medline, Embase, CINAHL and CENTRAL) were systematically searched. RCTs evaluating a low FODMAP diet in IBD on disease activity, inflammatory markers, gastrointestinal symptoms, and quality of life (QoL), and qualitative studies reporting patient experiences of low FODMAP interventions (in either IBS or IBD), were included. Outcome data were meta-analysed as standardised mean differences or odds ratios. Qualitative data underwent content analysis using the Health Belief Model.
RESULTS: Five RCTs (n = 224) and two qualitative studies (n = 30 IBS patients, no studies in IBD) were included. Compared with controls, there was no effect of a low FODMAP diet on disease activity (Crohn's disease: SMD -0.33; -0.77, 0.11; ulcerative colitis: SMD -0.31; -0.78, 0.15) or faecal calprotectin (SMD -0.20; -0.49, 0.09), but lower severity of global IBS symptoms (SMD -0.56; -0.90, 0.23) and higher QoL scores (SMD 0.43; 0.05, 0.81) at end of intervention. Patients with IBS described implementation as burdensome (Severity, Barriers), inadequate professional support (Susceptibility) and found it difficult to interpret information (Susceptibility, Barriers). Meal plans and recipes (Cue to action and Self-efficacy) gained through dietitian-led information sessions were valued (Benefits).
CONCLUSIONS: A low FODMAP diet does not impact IBD disease activity and inflammation markers, but leads to improved gastrointestinal symptoms compared with controls. The diet should be considered for improving functional gastrointestinal symptoms, but not an IBD treatment. There are minimal studies about patient experiences implementing the low FODMAP diet, all in IBS. Future research should assess patient experiences of low FODMAP diet implementation, specific to IBD.
PROTOCOL REGISTRATION: PROSPERO CRD42023480762, Open Science Framework.",Ville A; McRae R; Nomchong J; Reidlinger DP; Davidson AR; Staudacher HM; Albarqouni L,2025,Journal of human nutrition and dietetics : the official journal of the British Dietetic Association,38,4,e70106,10.1111/jhn.70106,"Ville, A., McRae, R., Nomchong, J., Reidlinger, D. P., Davidson, A. R., Staudacher, H. M., & Albarqouni, L. (2025). Effects of a Low FODMAP Diet in Inflammatory Bowel Disease and Patient Experiences: A Mixed Methods Systematic Literature Review and Meta-Analysis.. Journal of human nutrition and dietetics : the official journal of the British Dietetic Association, 38(4), e70106. https://doi.org/10.1111/jhn.70106",https://pubmed.ncbi.nlm.nih.gov/40765115/,"['Journal Article', 'Systematic Review', 'Meta-Analysis']","['IBS', 'inflammatory bowel disease']",True
