37957831,Human Intestinal Organoids: Modeling Gastrointestinal Physiology And Immunopathology - Current Applications And Limitations.,"human intestinal organoids are an ideal model system for studying gastrointestinal physiology and immunopathology. altered physiology and mucosal immune response are hallmarks of numerous intestinal functional and inflammatory diseases, including inflammatory bowel disease (ibd), coeliac disease, irritable bowel syndrome (ibs), and obesity. these conditions impact the normal epithelial functions of the intestine, such as absorption, barrier function, secretion, and host-microbiome communication. they are accompanied by characteristic intestinal symptoms and have significant societal, economic, and healthcare burdens. to develop new treatment options, cutting-edge research is required to investigate their etiology and pathology. human intestinal organoids derived from patient tissue recapitulate the key physiological and immunopathological aspects of these conditions, providing a promising platform for elucidating disease mechanisms. this review will summarize recent reports on patient-derived human small intestinal and colonic organoids and highlight how these models have been used to study intestinal epithelial functions in the context of inflammation, altered physiology, and immune response. furthermore, it will elaborate on the various organoid systems in use and the techniques/assays currently available to study epithelial functions. finally, it will conclude by discussing the limitations and future perspectives of organoid technology.",Flood P; Hanrahan N; Nally K; Melgar S,2024,European journal of immunology,54,2,e2250248,10.1002/eji.202250248,"Flood, P., Hanrahan, N., Nally, K., & Melgar, S. (2024). Human intestinal organoids: Modeling gastrointestinal physiology and immunopathology - current applications and limitations.. European journal of immunology, 54(2), e2250248. https://doi.org/10.1002/eji.202250248",https://pubmed.ncbi.nlm.nih.gov/37957831/,"['Journal Article', 'Review']","['IBS', 'inflammatory bowel disease']",False,True
32577079,Tryptophan Metabolites Along The Microbiota-Gut-Brain Axis: An Interkingdom Communication System Influencing The Gut In Health And Disease.,"the 'microbiota-gut-brain axis' plays a fundamental role in maintaining host homeostasis, and different immune, hormonal, and neuronal signals participate to this interkingdom communication system between eukaryota and prokaryota. the essential aminoacid tryptophan, as a precursor of several molecules acting at the interface between the host and the microbiota, is fundamental in the modulation of this bidirectional communication axis. in the gut, tryptophan undergoes 3 major metabolic pathways, the 5-ht, kynurenine, and ahr ligand pathways, which may be directly or indirectly controlled by the saprophytic flora. the importance of tryptophan metabolites in the modulation of the gastrointestinal tract is suggested by several preclinical and clinical studies; however, a thorough revision of the available literature has not been accomplished yet. thus, this review attempts to cover the major aspects on the role of tryptophan metabolites in host-microbiota cross-talk underlaying regulation of gut functions in health conditions and during disease states, with particular attention to 2 major gastrointestinal diseases, such as irritable bowel syndrome (ibs) and inflammatory bowel disease (ibd), both characterized by psychiatric disorders. research in this area opens the possibility to target tryptophan metabolism to ameliorate the knowledge on the pathogenesis of both diseases, as well as to discover new therapeutic strategies based either on conventional pharmacological approaches or on the use of pre- and probiotics to manipulate the microbial flora.",Bosi A; Banfi D; Bistoletti M; Giaroni C; Baj A,2020,International journal of tryptophan research : IJTR,13,,1178646920928984,10.1177/1178646920928984,"Bosi, A., Banfi, D., Bistoletti, M., Giaroni, C., & Baj, A. (2020). Tryptophan Metabolites Along the Microbiota-Gut-Brain Axis: An Interkingdom Communication System Influencing the Gut in Health and Disease.. International journal of tryptophan research : IJTR, 13, 1178646920928984. https://doi.org/10.1177/1178646920928984",https://pubmed.ncbi.nlm.nih.gov/32577079/,"['Journal Article', 'Review']","['IBS', 'inflammatory bowel disease']",False,True
38446808,The Role Of Anthocyanins In Alleviating Intestinal Diseases: A Mini Review.,"anthocyanins are phytonutrients with physiological activity belonging to the flavonoid family whose transport and absorption in the human body follow specific pathways. in the upper gastrointestinal tract, anthocyanins are rarely absorbed intact by active transporters, with most reaching the colon, where bacteria convert them into metabolites. there is mounting evidence that anthocyanins can be used for prevention and treatment of intestinal diseases, including inflammatory bowel disease (ibd), irritable bowel syndrome (ibs), and colorectal cancer (crc), through the protective function on the intestinal epithelial barrier, immunomodulation, antioxidants, and gut microbiota metabolism. dietary anthocyanins are summarized in this comprehensive review with respect to their classification and structure as well as their absorption and transport mechanisms within the gastrointestinal tract. additionally, the review delves into the role and mechanism of anthocyanins in treating common intestinal diseases. these insights will deepen our understanding of the potential benefits of natural anthocyanins for intestinal disorders.",Liu Y; Fernandes I; Mateus N; Oliveira H; Han F,2024,Journal of agricultural and food chemistry,72,11,5491-5502,10.1021/acs.jafc.3c07741,"Liu, Y., Fernandes, I., Mateus, N., Oliveira, H., & Han, F. (2024). The Role of Anthocyanins in Alleviating Intestinal Diseases: A Mini Review.. Journal of agricultural and food chemistry, 72(11), 5491-5502. https://doi.org/10.1021/acs.jafc.3c07741",https://pubmed.ncbi.nlm.nih.gov/38446808/,"['Journal Article', 'Review']","['IBS', 'inflammatory bowel disease']",False,True
40657742,The Sick Gut With Diarrhea: Fodmaps For Treatment?,"purpose of review: to examine in the light of recent data whether diets low in fodmaps (a now classic exclusion diet for treatment for ibs: irritable bowel syndrome) have shown interest/efficacy in diseases of the digestive tract (beyond ibs) manifesting as diarrhea.
recent findings: very little good quality data or publications are available in recent medical literature. it is therefore difficult to estimate that the low fodmap diet can be considered with a good level of confidence outside of ibs except in borderline symptomatic forms or with associated pathophysiology (e.g. ibd: inflammatory bowel disease).
summary: there is a lack of quality data on the benefits, safety and value of lfd, outside of ibs. this is particularly the case in the majority of organic digestive diseases, notably with diarrhea, unless accompanied by dysregulation of the intestine-brain axis (and so with ibs symptoms), for example in post-inflammatory situations. when effective, which is currently highly unpredictable, the mechanism of action remains poorly understood.",Crenn P,2025,Current opinion in clinical nutrition and metabolic care,28,5,422-426,10.1097/MCO.0000000000001141,"Crenn, P. (2025). The sick gut with diarrhea: FODMAPS for treatment?. Current opinion in clinical nutrition and metabolic care, 28(5), 422-426. https://doi.org/10.1097/MCO.0000000000001141",https://pubmed.ncbi.nlm.nih.gov/40657742/,"['Journal Article', 'Review']","['IBS', 'inflammatory bowel disease']",False,True
40904246,"Median Arcuate Ligament Syndrome: Challenges, Comorbidities, And Controversies.","purpose of review: median arcuate ligament syndrome (mals) is understood to be a condition where compression of the celiac artery by the median arcuate ligament (mal) may lead to symptoms of postprandial or exercise-induced abdominal pain, nausea, vomiting, diarrhea, oral aversion, and weight loss. this review summarizes recent literature on pediatric mals while highlighting the challenges, comorbidities, and controversies encountered in this condition.
recent findings: the pathophysiologic mechanism by which mals leads to pain is currently unknown. several overlapping conditions are described in mals, including mental health comorbidities to autonomic disorders such as orthostatic intolerance, pots, or ehlers-danlos syndrome. comorbid gastrointestinal conditions may include gastroesophageal reflux disease (gerd), inflammatory bowel disease (ibd), irritable bowel syndrome (ibs), and gastroparesis. this overlap makes it difficult to distinguish the cause of broad symptoms patients may experience. mals remains a complex and controversial topic with particular challenges in consensus diagnostic criteria, normative values in children, symptom definition or correlation, patient selection, predictive outcomes, or long-term follow-up data.
summary: patients with mals deserve a comprehensive multidisciplinary team to address their health. there is also a desperate need for collaborative research including randomized control trials in adults and a multicenter patient registry.",Mostamand S,2025,Current opinion in pediatrics,37,5,447-451,10.1097/MOP.0000000000001503,"Mostamand, S. (2025). Median arcuate ligament syndrome: challenges, comorbidities, and controversies.. Current opinion in pediatrics, 37(5), 447-451. https://doi.org/10.1097/MOP.0000000000001503",https://pubmed.ncbi.nlm.nih.gov/40904246/,"['Journal Article', 'Review']","['IBS', 'inflammatory bowel disease']",False,True
40002733,"Beyond The ""Master"" Role In Allergy: Insights Into Intestinal Mast Cell Plasticity And Gastrointestinal Diseases.","mast cells (mcs) are essential components of the immune system that enter the circulation as immature bone marrow progenitors and differentiate in peripheral organs under the influence of microenvironment factors. as tissue-resident secretory immune cells, mcs rapidly detect the presence of bacteria and parasites because they harbor many surface receptors, which enable their activation via a multitude of stimuli. mc activation has been traditionally linked to ige-mediated allergic reactions, but mcs play a pivotal role in different physiological and pathological processes. in gut, mcs are essential for the maintenance of gastrointestinal (gi) barrier function, and their interactions with neurons, immune cells, and epithelial cells have been related to various gi disorders. this review recapitulates intestinal mc roles in diseases with a main focus on inflammatory bowel disease (ibd) and irritable bowel syndrome (ibs). emerging therapies targeting mcs and their mediators in clinical practices will also be discussed.",Molfetta R; Carnevale A; Marangio C; Putro E; Paolini R,2025,Biomedicines,13,2,,10.3390/biomedicines13020320,"Molfetta, R., Carnevale, A., Marangio, C., Putro, E., & Paolini, R. (2025). Beyond the ""Master"" Role in Allergy: Insights into Intestinal Mast Cell Plasticity and Gastrointestinal Diseases.. Biomedicines, 13(2). https://doi.org/10.3390/biomedicines13020320",https://pubmed.ncbi.nlm.nih.gov/40002733/,"['Journal Article', 'Review']","['IBS', 'inflammatory bowel disease']",False,True
40906599,Volatile Organic Compounds In Irritable Bowel Syndrome: Microbial Insights Into Gut-Brain Dynamics And Clinical Applications.,"background: irritable bowel syndrome (ibs) affects 4.1% of the global population, posing a significant healthcare challenge due to its complex pathophysiology and limited treatment options. gut microbiota-derived volatile organic compounds (vocs) are increasingly recognized as key players in ibs, with the potential for non-invasive diagnostics and personalized management.
summary: this review examines vocs-such as short-chain fatty acids (scfas), hydrocarbons, and alcohols-as microbial metabolites influencing ibs through gut barrier function, inflammation, motility, and gut-brain signaling. cross-sectional studies highlight the diagnostic accuracy of vocs (area under the curve (auc) 0.76-0.99) in distinguishing ibs from healthy controls (hc) and conditions like inflammatory bowel disease (ibd), while longitudinal studies underscore their utility in predicting and reflecting microbial changes to microbiota-targeted therapies. despite this promise, variability in study designs, methodological inconsistencies, and confounding factors hinder clinical translation.
key messages: vocs illuminate the microbial underpinnings of ibs and its gut-brain interactions, offering a pathway to precise diagnosis and treatment stratification. however, their full potential awaits standardized sampling, analytical protocols, and robust clinical trials to ensure reliability and applicability in ibs care.",Nguyen DC; Gonlachanvit S; Sukaram T; Patcharatrakul T,2025,Digestion,,,1-14,10.1159/000548310,"Nguyen, D. C., Gonlachanvit, S., Sukaram, T., & Patcharatrakul, T. (2025). Volatile Organic Compounds in Irritable Bowel Syndrome: Microbial Insights into Gut-Brain Dynamics and Clinical Applications.. Digestion, 1-14. https://doi.org/10.1159/000548310",https://pubmed.ncbi.nlm.nih.gov/40906599/,"['Journal Article', 'Review']","['IBS', 'inflammatory bowel disease']",False,True
38568932,Causality Of Genetically Determined Blood Metabolites On Irritable Bowel Syndrome: A Mendelian Randomization Study.,"background: irritable bowel syndrome (ibs) is one of the most common functional bowel disorders and dysmetabolism plays an important role in the pathogenesis of disease. nevertheless, there remains a lack of information regarding the causal relationship between circulating metabolites and ibs. a two-sample mendelian randomization (mr) analysis was conducted in order to evaluate the causal relationship between genetically proxied 486 blood metabolites and ibs.
methods: a two-sample mr analysis was implemented to assess the causality of blood metabolites on ibs. the study utilized a genome-wide association study (gwas) to examine 486 metabolites as the exposure variable while employing a gwas study with 486,601 individuals of european descent as the outcome variable. the inverse-variance weighted (ivw) method was used to estimate the causal relationship of metabolites on ibs, while several methods were performed to eliminate the pleiotropy and heterogeneity. another gwas data was used for replication and meta-analysis. in addition, reverse mr and linkage disequilibrium score regression (ldsc) were employed for additional assessment. multivariable mr analysis was conducted in order to evaluate the direct impact of metabolites on ibs.
results: three known and two unknown metabolites were identified as being associated with the development of ibs. higher levels of butyryl carnitine (or(95%ci):1.10(1.02-1.18),p = 0.009) and tetradecanedioate (or(95%ci):1.13(1.04-1.23),p = 0.003)increased susceptibility of ibs and higher levels of stearate(18:0)(or(95%ci):0.72(0.58-0.89),p = 0.003) decreased susceptibility of ibs.
conclusion: the metabolites implicated in the pathogenesis of ibs possess potential as biomarkers and hold promise for elucidating the underlying biological mechanisms of this condition.",Dai X; Liang M; Dai Y; Ding S; Sun X; Xu L,2024,PloS one,19,4,e0298963,10.1371/journal.pone.0298963,"Dai, X., Liang, M., Dai, Y., Ding, S., Sun, X., & Xu, L. (2024). Causality of genetically determined blood metabolites on irritable bowel syndrome: A Mendelian randomization study.. PloS one, 19(4), e0298963. https://doi.org/10.1371/journal.pone.0298963",https://pubmed.ncbi.nlm.nih.gov/38568932/,"['Meta-Analysis', 'Journal Article']","['IBS', 'inflammatory bowel disease']",False,True
40801563,"Rethinking Short-Chain Fatty Acids: A Closer Look At Propionate In Inflammation, Metabolism, And Mucosal Homeostasis.","propionate is a short-chain fatty acid (scfa) produced by gut microbiota through the fermentation of dietary fibers. among the scfas, butyrate stands out and has been extensively studied for its beneficial effects; however, propionate has received less attention despite its relevant roles in immune modulation, metabolism, and mucosal homeostasis. this narrative review focuses on propionate's effects on metabolism, inflammation, microbiota, and gastrointestinal diseases. propionate acts as a signalling molecule through ffar2/ffar3 receptors and modulates immunity, energy metabolism, and gut-brain communication. it has beneficial effects in metabolic disorders, inflammatory bowel disease (ibd), and alcohol-related liver disease (ald). however, excessive accumulation is linked to neurotoxicity, autism spectrum disorder (asd), and mitochondrial dysfunction. its effects are dose-dependent and tissue-specific, with both protective and harmful potentials depending on the context. propionate use requires a personalized approach, considering the pathological context, host microbiota composition, and appropriate dosage to avoid adverse effects.",Facchin S; Calgaro M; Savarino EV,2025,Cells,14,15,,10.3390/cells14151130,"Facchin, S., Calgaro, M., & Savarino, E. V. (2025). Rethinking Short-Chain Fatty Acids: A Closer Look at Propionate in Inflammation, Metabolism, and Mucosal Homeostasis.. Cells, 14(15). https://doi.org/10.3390/cells14151130",https://pubmed.ncbi.nlm.nih.gov/40801563/,"['Journal Article', 'Review']","['IBS', 'inflammatory bowel disease']",False,True
37734419,"Pathobionts In Inflammatory Bowel Disease: Origins, Underlying Mechanisms, And Implications For Clinical Care.","the gut microbiota plays a significant role in the pathogenesis of both forms of inflammatory bowel disease (ibd), namely, crohn's disease (cd) and ulcerative colitis (uc). although evidence suggests dysbiosis and loss of beneficial microbial species can exacerbate ibd, many new studies have identified microbes with pathogenic qualities, termed ""pathobionts,"" within the intestines of patients with ibd. the concept of pathobionts initiating or driving the chronicity of ibd has largely focused on the putative aggravating role that adherent invasive escherichia coli may play in cd. however, recent studies have identified additional bacterial and fungal pathobionts in patients with cd and uc. this review will highlight the characteristics of these pathobionts and their implications for ibd treatment. beyond exploring the origins of pathobionts, we discuss those associated with specific clinical features and the potential mechanisms involved, such as creeping fat (clostridium innocuum) and impaired wound healing (debaryomyces hansenii) in patients with cd as well as the increased fecal proteolytic activity (bacteroides vulgatus) seen as a biomarker for uc severity. finally, we examine the potential impact of pathobionts on current ibd therapies, and several new approaches to target pathobionts currently in the early stages of development. despite recognizing that pathobionts likely contribute to the pathogenesis of ibd, more work is needed to define their modes of action. determining whether causal relationships exist between pathobionts and specific disease characteristics could pave the way for improved care for patients, particularly for those not responding to current ibd therapies.",Gilliland A; Chan JJ; De Wolfe TJ; Yang H; Vallance BA,2024,Gastroenterology,166,1,44-58,10.1053/j.gastro.2023.09.019,"Gilliland, A., Chan, J. J., De Wolfe, T. J., Yang, H., & Vallance, B. A. (2024). Pathobionts in Inflammatory Bowel Disease: Origins, Underlying Mechanisms, and Implications for Clinical Care.. Gastroenterology, 166(1), 44-58. https://doi.org/10.1053/j.gastro.2023.09.019",https://pubmed.ncbi.nlm.nih.gov/37734419/,"['Journal Article', 'Review']","['IBD', 'UC', 'CD']",False,True
37455149,"Recent Advances In The Treatment Of Ibd: Targets, Mechanisms And Related Therapies.","inflammatory bowel disease (ibd), as a representative inflammatory disease, currently has multiple effective treatment options available and new therapeutic strategies are being actively explored to further increase the treatment options for patients with ibd. furthermore, biologic agents and small molecule drugs developed for ulcerative colitis (uc) and crohn's disease (cd) have evolved toward fewer side effects and more accurate targeting. novel inhibitors that target cytokines (such as il-12/23 inhibitors, pde4 inhibitors), integrins (such as integrin inhibitors), cytokine signaling pathways (such as jak inhibitors, smad7 blocker) and cell signaling receptors (such as s1p receptor modulator) have become the preferred treatment choice for many ibd patients. conventional therapies such as 5-aminosalicylic acid, corticosteroids, immunomodulators and anti-tumor necrosis factor agents continue to demonstrate therapeutic efficacy, particularly in combination with drug therapy. this review integrates research from chemical, biological and adjuvant therapies to evaluate current and future ibd therapies, highlighting the mechanism of action of each therapy and emphasizing the potential of development prospects.",Liu J; Di B; Xu LL,2023,Cytokine & growth factor reviews,71-72,,1-12,10.1016/j.cytogfr.2023.07.001,"Liu, J., Di, B., & Xu, L. L. (2023). Recent advances in the treatment of IBD: Targets, mechanisms and related therapies.. Cytokine & growth factor reviews, 71-72, 1-12. https://doi.org/10.1016/j.cytogfr.2023.07.001",https://pubmed.ncbi.nlm.nih.gov/37455149/,"['Journal Article', 'Review', ""Research Support, Non-U.S. Gov't""]","['IBD', 'UC', 'CD']",False,True
36012618,Inflammatory Bowel Disease: A Review Of Pre-Clinical Murine Models Of Human Disease.,"crohn's disease (cd) and ulcerative colitis (uc) are both highly inflammatory diseases of the gastrointestinal tract, collectively known as inflammatory bowel disease (ibd). although the cause of ibd is still unclear, several experimental ibd murine models have enabled researchers to make great inroads into understanding human ibd pathology. here, we discuss the current pre-clinical experimental murine models for human ibd, including the chemical-induced trinitrobenzene sulfonic acid (tnbs) model, oxazolone and dextran sulphate sodium (dss) models, the gene-deficient i-kappa-b kinase gamma (iκκ-γ) and interleukin(il)-10 models, and the cd4+ t-cell transfer model. we offer a comprehensive review of how these models have been used to dissect the etiopathogenesis of disease, alongside their limitations. furthermore, the way in which this knowledge has led to the translation of experimental findings into novel clinical therapeutics is also discussed.",Katsandegwaza B; Horsnell W; Smith K,2022,International journal of molecular sciences,23,16,,10.3390/ijms23169344,"Katsandegwaza, B., Horsnell, W., & Smith, K. (2022). Inflammatory Bowel Disease: A Review of Pre-Clinical Murine Models of Human Disease.. International journal of molecular sciences, 23(16). https://doi.org/10.3390/ijms23169344",https://pubmed.ncbi.nlm.nih.gov/36012618/,"['Journal Article', 'Review']","['IBD', 'UC', 'CD']",False,True
33527789,Incidence And Prevalence Of Inflammatory Bowel Disease Across Asia.,"inflammatory bowel diseases (ibd), including ulcerative colitis (uc) and crohn's disease (cd), are chronic inflammatory disorders of the gastrointestinal tract caused by interactions between genetic, environmental, immunological, and microbial factors. while the incidence and prevalence of ibd in asian populations were relatively lower than those in western countries, they appear to be gradually increasing. a westernized diet, high socioeconomic status, improvement of hygiene, and development of vaccination could affect the increases in ibd incidence and prevalence in asian countries. this review describes the latest trends in the incidence and prevalence of ibd in asia. studying the epidemiology of ibd in asia may unravel the etiopathogenesis of and risk factors for ibd.",Park J; Cheon JH,2021,Yonsei medical journal,62,2,99-108,10.3349/ymj.2021.62.2.99,"Park, J., & Cheon, J. H. (2021). Incidence and Prevalence of Inflammatory Bowel Disease across Asia.. Yonsei medical journal, 62(2), 99-108. https://doi.org/10.3349/ymj.2021.62.2.99",https://pubmed.ncbi.nlm.nih.gov/33527789/,"['Journal Article', 'Review']","['IBD', 'UC', 'CD']",False,True
