39577473,In Reviewing The Emerging Biomarkers Of Human Inflammatory Bowel Disease (Ibd): Endothelial Progenitor Cells (Epc) And Their Vesicles As Potential Biomarkers Of Cardiovascular Manifestations And Targets For Personalized Treatments.,"inflammatory bowel diseases (ibd) are chronic inflammatory and pathological conditions of the gastrointestinal tract, which include two main clinical subtypes: crohn's disease (cd) and ulcerative colitis (uc). ibds show an increase in their age-standardized global incidence rate worldwide, with no gender differences, although the age-standardized mortality rate has decreased over the years. indeed, thanks to recent therapies with novel mechanisms of action, including those with biologics and small molecules, it has been possible to reduce the mortality rate of ibds. however, a significant percentage of ibd patients remain refractory to these multiple advanced therapies. therefore, another challenge of ibd research remains the development of novel therapies with novel agents or cells that could improve the quality of life and outcome of ibd patients. furthermore, another aspect to be studied in ibds is not only the high risk of progression not only to neoplastic transformation but also to the development of cardiovascular disease (cvd). consequently, 25-40 % of ibd patients present with cardiovascular manifestations. here, we propose that the altered number and functions of endothelial progenitor cells (epcs) may represent one of the crucial mechanisms associated with incomplete/delayed healing of ibd and may offer the possibility of using them, as well as their vesicles and content, as novel biomarkers and potential candidates of cell therapy for ibd. the advantages and limitations are extensively described and discussed.",Balistreri CR,2024,Mechanisms of ageing and development,222,,112006,10.1016/j.mad.2024.112006,"Balistreri, C. R. (2024). In reviewing the emerging biomarkers of human inflammatory bowel disease (IBD): Endothelial progenitor cells (EPC) and their vesicles as potential biomarkers of cardiovascular manifestations and targets for personalized treatments.. Mechanisms of ageing and development, 222, 112006. https://doi.org/10.1016/j.mad.2024.112006",https://pubmed.ncbi.nlm.nih.gov/39577473/,"['Journal Article', 'Review']","['IBD', 'UC', 'CD']",False,True
33584261,Thiopurines: Recent Topics And Their Role In The Treatment Of Inflammatory Bowel Diseases.,"ulcerative colitis (uc) and crohn's disease (cd) are chronic inflammatory bowel diseases (ibd) of unknown etiology, characterized by repeated relapse and remission. the efficacy of thiopurine in ibd was first reported in the late 1960s. thiopurines are used to alleviate the symptoms of ibd, especially uc. these drugs have a steroid-sparing potential and are widely used for the purpose of maintaining long-term remission in steroid-dependent cases. therefore, thiopurines tend to be used long-term, but adverse events that accompany long-term use, such as lymphoproliferative disorders, must be monitored with care. in contrast, thiopurine plays a critical role in controlling the immunogenicity of biologics. furthermore, although thiopurine is an old drug, new findings, including the prediction of serious adverse events such as severe alopecia and acute advanced leukopenia, by nudix hydrolase 15 gene polymorphism analysis, as well as the possibility of appropriate drug monitoring by detailed analysis of 6-thioguanine nucleotides have been clarified. however, the consequences of thiopurine withdrawal have not been determined and further studies, including randomized controlled trials, are necessary to answer the clinical question regarding the scenarios in which thiopurine withdrawal is possible.",Tominaga K; Sugaya T; Tanaka T; Kanazawa M; Iijima M; Irisawa A,2020,Frontiers in pharmacology,11,,582291,10.3389/fphar.2020.582291,"Tominaga, K., Sugaya, T., Tanaka, T., Kanazawa, M., Iijima, M., & Irisawa, A. (2020). Thiopurines: Recent Topics and Their Role in the Treatment of Inflammatory Bowel Diseases.. Frontiers in pharmacology, 11, 582291. https://doi.org/10.3389/fphar.2020.582291",https://pubmed.ncbi.nlm.nih.gov/33584261/,"['Journal Article', 'Review']","['IBD', 'UC', 'CD']",False,True
38793089,Exploring The Gut Microbiome'S Role In Inflammatory Bowel Disease: Insights And Interventions.,"inflammatory bowel disease (ibd), encompassing crohn's disease (cd) and ulcerative colitis (uc), is a chronic and relapsing inflammatory condition of the intestine that significantly impairs quality of life and imposes a heavy burden on healthcare systems globally. while the exact etiology of ibd is unclear, it is influenced by genetic, environmental, immunological, and microbial factors. recent advances highlight the gut microbiome's pivotal role in ibd pathogenesis. the microbial dysbiosis characteristic of ibd, marked by a decline in beneficial bacteria and an increase in pathogenic microbes, suggests a profound connection between microbial imbalance and disease mechanisms. this review explores diagnostic approaches to ibd that integrate clinical assessment with advanced microbiological analyses, highlighting the potential of microbiome profiling as a non-invasive diagnostic tool. in addition, it evaluates conventional and emerging treatments and discusses microbiome-targeted intervention prospects, such as probiotics, symbiotics, and faecal microbiota transplantation. the necessity for future research to establish their efficacy and safety is emphasised.",Gyriki D; Nikolaidis C; Stavropoulou E; Bezirtzoglou I; Tsigalou C; Vradelis S; Bezirtzoglou E,2024,Journal of personalized medicine,14,5,,10.3390/jpm14050507,"Gyriki, D., Nikolaidis, C., Stavropoulou, E., Bezirtzoglou, I., Tsigalou, C., Vradelis, S., & Bezirtzoglou, E. (2024). Exploring the Gut Microbiome's Role in Inflammatory Bowel Disease: Insights and Interventions.. Journal of personalized medicine, 14(5). https://doi.org/10.3390/jpm14050507",https://pubmed.ncbi.nlm.nih.gov/38793089/,"['Journal Article', 'Review']","['IBD', 'UC', 'CD']",False,True
34092165,Association Between Genetic Variants In Znf365 And Inflammatory Bowel Disease Risk In Caucasians: A Meta-Analysis And Trial Sequential Analysis.,"objective: the published studies regarding the relationships between zinc finger 365 (znf365) polymorphisms and inflammatory bowel disease (ibd) risk in caucasians have yielded conflicting results. therefore, we performed a meta-analysis to clarify this issue.
methods: the electronic databases of pubmed, web of science, wiley online library, and embase were searched for eligible studies up to 31 november 2020. the quality of eligible studies was evaluated using the newcastle-ottawa scale. the pooled odds ratios (ors) with 95% confidence intervals (cis) under different genetic models were calculated to assess the strength of associations.
results: a total of 22 relevant case-control studies with 9542 ulcerative colitis (uc) patients and 13,886 controls, as well as 13,651 crohn's disease (cd) patients and 15,256 controls, were involved in our meta-analysis. rs10761659 polymorphism significantly decreased cd and uc risk (except for the heterozygous model and the dominant model in uc), and rs10995271 polymorphism was significantly associated with uc (except for the heterozygous model and dominant model) rather than cd.
conclusions: the meta-analysis demonstrated that the rs10761659 polymorphism might be a protective factor for both uc and cd in caucasians, while the rs10995271 polymorphism might be a risk factor for uc rather than cd in caucasians.",Wu PB; Zhang Y; Nie G; Huang X; Yu YJ; Yin AN; Zhou R; He CP; Wang P,2021,Expert review of clinical immunology,17,8,915-921,10.1080/1744666X.2021.1939012,"Wu, P. B., Zhang, Y., Nie, G., Huang, X., Yu, Y. J., Yin, A. N., Zhou, R., He, C. P., & Wang, P. (2021). Association between genetic variants in ZNF365 and inflammatory bowel disease risk in Caucasians: a meta-analysis and trial sequential analysis.. Expert review of clinical immunology, 17(8), 915-921. https://doi.org/10.1080/1744666X.2021.1939012",https://pubmed.ncbi.nlm.nih.gov/34092165/,"['Journal Article', 'Meta-Analysis']","['IBD', 'UC', 'CD']",False,True
40755720,The Current Landscape Of Fecal Microbiota Transplantation In Treating Inflammatory Bowel Disease.,"inflammatory bowel disease (ibd), which includes ulcerative colitis (uc) and crohn's disease (cd), is a chronic, immune-mediated disorder that impacts the intestinal tract. the gut microbiota, a diverse community of microorganisms, plays a pivotal role in the initiation, development, and progression of ibd by modulating inflammation, and immune responses, and maintaining gut homeostasis. dysbiosis, or an imbalance in the gut microbiota, is frequently observed in ibd patients and is believed to contribute to the pathogenesis of the disease by disrupting the mucosal immune system. fecal microbiota transplantation (fmt) involves transferring feces from a healthy donor (hd) into a recipient and has emerged as a promising therapeutic approach for ibd. the primary goal of fmt is to restore microbial balance in the recipient's gut, improving both microbiota composition and immune function. numerous preclinical and clinical studies have demonstrated varying degrees of success in alleviating ibd symptoms through fmt. the benefits of fmt include modulation of gut bacteria abundance, restoration of microbial diversity, and enhancement of immune system regulation, all of which contribute to reducing ibd-related inflammation. this review presents a comprehensive analysis of animal studies and clinical trials exploring using fmt as a treatment for ibd. understanding the underlying mechanisms of fmt in ibd is crucial for designing effective therapeutic strategies and optimizing its clinical impact.",Bi Y; Cheng B; Zou B; Liu S; Cui Z,2025,Translational gastroenterology and hepatology,10,,55,10.21037/tgh-24-138,"Bi, Y., Cheng, B., Zou, B., Liu, S., & Cui, Z. (2025). The current landscape of fecal microbiota transplantation in treating inflammatory bowel disease.. Translational gastroenterology and hepatology, 10, 55. https://doi.org/10.21037/tgh-24-138",https://pubmed.ncbi.nlm.nih.gov/40755720/,"['Journal Article', 'Review']","['IBD', 'UC', 'CD']",False,True
32419327,Targeting Desmosomal Adhesion And Signalling For Intestinal Barrier Stabilization In Inflammatory Bowel Diseases-Lessons From Experimental Models And Patients.,"inflammatory bowel diseases (ibd) such as crohn's disease (cd) and ulcerative colitis (uc) have a complex and multifactorial pathogenesis which is incompletely understood. a typical feature closely associated with clinical symptoms is impaired intestinal epithelial barrier function. mounting evidence suggests that desmosomes, which together with tight junctions (tj) and adherens junctions (aj) form the intestinal epithelial barrier, play a distinct role in ibd pathogenesis. this is based on the finding that desmoglein (dsg) 2, a cadherin-type adhesion molecule of desmosomes, is required for maintenance of intestinal barrier properties both in vitro and in vivo, presumably via dsg2-mediated regulation of tj. mice deficient for intestinal dsg2 show increased basal permeability and are highly susceptible to experimental colitis. in several cohorts of ibd patients, intestinal protein levels of dsg2 are reduced and desmosome ultrastructure is altered suggesting that dsg2 is involved in ibd pathogenesis. in addition to its adhesive function, dsg2 contributes to enterocyte cohesion and intestinal barrier function. dsg2 is also involved in enterocyte proliferation, barrier differentiation and induction of apoptosis, in part by regulation of p38mapk and egfr signalling. in ibd, the function of dsg2 appears to be compromised via p38mapk activation, which is a critical pathway for regulation of desmosomes and is associated with keratin phosphorylation in ibd patients. in this review, the current findings on the role of dsg2 as a novel promising target to prevent loss of intestinal barrier function in ibd patients are discussed.",Schlegel N; Boerner K; Waschke J,2021,"Acta physiologica (Oxford, England)",231,1,e13492,10.1111/apha.13492,"Schlegel, N., Boerner, K., & Waschke, J. (2021). Targeting desmosomal adhesion and signalling for intestinal barrier stabilization in inflammatory bowel diseases-Lessons from experimental models and patients.. Acta physiologica (Oxford, England), 231(1), e13492. https://doi.org/10.1111/apha.13492",https://pubmed.ncbi.nlm.nih.gov/32419327/,"['Journal Article', ""Research Support, Non-U.S. Gov't"", 'Review']","['IBD', 'UC', 'CD']",False,True
34573401,C3435T Polymorphism Of The Abcb1 Gene In Polish Patients With Inflammatory Bowel Disease: A Case-Control And Meta-Analysis Study.,"p-glycoprotein encoded by the abcb1 gene constitutes a molecular barrier in the small and large bowel epithelium, and its different expression may influence susceptibility to inflammatory bowel disease (ibd). we aimed to assess the contribution of the c3435t polymorphism to disease risk in the polish population. a total of 100 patients (50 crohn's disease (cd), 50 ulcerative colitis (uc)) and 100 healthy controls were genotyped for the single nucleotide polymorphism (snp) c3435t by using the pcr-rflp method. patients were classified on the basis of disease phenotype and the specific treatment used. a meta-analysis was carried out of our results and those from previously published polish studies. there was no significant difference in allele and genotype frequencies in ibd patients compared with controls. for cd patients, a lower frequency of tt genotype in those with colonic disease, a lower frequency of t allele, and a higher frequency of c allele in those with luminal disease were observed, whereas for uc patients, a lower frequency of ct genotype was observed in those with left-sided colitis. a meta-analysis showed a tendency towards higher prevalence of cc genotype in uc cases. these results indicate that the c3435t variants may confer a risk for uc and influence disease behaviour.",Petryszyn P; Dudkowiak R; Gruca A; Jaźwińska-Tarnawska E; Ekk-Cierniakowski P; Poniewierka E; Wiela-Hojeńska A; Głowacka K,2021,Genes,12,9,,10.3390/genes12091419,"Petryszyn, P., Dudkowiak, R., Gruca, A., Jaźwińska-Tarnawska, E., Ekk-Cierniakowski, P., Poniewierka, E., Wiela-Hojeńska, A., & Głowacka, K. (2021). C3435T Polymorphism of the ABCB1 Gene in Polish Patients with Inflammatory Bowel Disease: A Case-Control and Meta-Analysis Study.. Genes, 12(9). https://doi.org/10.3390/genes12091419",https://pubmed.ncbi.nlm.nih.gov/34573401/,"['Journal Article', 'Meta-Analysis']","['IBD', 'UC', 'CD']",False,True
38905376,Inflammatory Proteins May Mediate The Causal Relationship Between Gut Microbiota And Inflammatory Bowel Disease: A Mediation And Multivariable Mendelian Randomization Study.,"this research investigates the causal relationships among gut microbiota, inflammatory proteins, and inflammatory bowel disease (ibd), including crohn disease (cd) and ulcerative colitis (uc), and identifies the role of inflammatory proteins as potential mediators. our study analyzed gut microbiome data from 13,266 samples collected by the mibiogen alliance, along with inflammatory protein data from recent research by zhao et al, and genetic data on cd and uc from the international inflammatory bowel disease genetics consortium (iibdgc). we used mendelian randomization (mr) to explore the associations, complemented by replication, meta-analysis, and multivariable mr techniques for enhanced accuracy and robustness. our analysis employed several statistical methods, including inverse-variance weighting, mr-egger, and the weighted median method, ensuring comprehensive and precise evaluation. after mr analysis, replication and meta-analysis, we revealed significant associations between 11 types of gut microbiota and 17 inflammatory proteins were associated with cd and uc. mediator mr analysis and multivariable mr analysis showed that in cd, the cd40l receptor mediated the causal effect of defluviitaleaceae ucg-011 on cd (mediation ratio 8.3%), and the hepatocyte growth factor mediated the causal effect of odoribacter on cd (mediation ratio 18%). in uc, the c-c motif chemokine 4 mediated the causal effect of ruminococcus2 on uc (mediation ratio 4%). this research demonstrates the interactions between specific gut microbiota, inflammatory proteins, and cd and uc. furthermore, the cd40l receptor may mediate the relationship between defluviitaleaceae ucg-011 and cd; the hepatocyte growth factor may mediate the relationship between odoribacter and cd; and the c-c motif chemokine 4 may mediate the relationship between ruminococcus2 and uc. the identified associations and mediation effects offer insights into potential therapeutic approaches targeting the gut microbiome for managing cd and uc.",Huang YL; Zheng JM; Shi ZY; Chen HH; Wang XT; Kong FB,2024,Medicine,103,25,e38551,10.1097/MD.0000000000038551,"Huang, Y. L., Zheng, J. M., Shi, Z. Y., Chen, H. H., Wang, X. T., & Kong, F. B. (2024). Inflammatory proteins may mediate the causal relationship between gut microbiota and inflammatory bowel disease: A mediation and multivariable Mendelian randomization study.. Medicine, 103(25), e38551. https://doi.org/10.1097/MD.0000000000038551",https://pubmed.ncbi.nlm.nih.gov/38905376/,"['Journal Article', 'Meta-Analysis']","['IBD', 'UC', 'CD']",False,True
32606588,Therapeutic Oligonucleotides For Patients With Inflammatory Bowel Diseases.,"introduction: the better understanding of the molecular mechanisms, which drive the pathological process in the gut of patients with crohn's disease (cd) and patients with ulcerative colitis (uc), the major forms of inflammatory bowel diseases (ibd) in humans, has facilitated the development of novel therapeutic compounds. among these, antisense oligonucleotides (asos) have been used to inhibit the expression of molecules, which sustain the ibd-associated mucosal inflammation.
areas covered: in this short review, we summarize experimental and clinical data on the use of asos in ibd.
expert opinion: preclinical work indicates that the modulation of specific inflammatory pathways through the use of asos is highly effective and associates with low risk of adverse events. initial clinical studies have confirmed the benefit of some asos even though no compound has yet reached the market. further experimentation is warranted to establish the optimal route of administration for each aso, ascertain whether and how long asos maintain their activity following administration, and identify which patient can benefit from specific aso treatment.",Marafini I; Monteleone G,2020,Biologics : targets & therapy,14,,47-51,10.2147/BTT.S257638,"Marafini, I., & Monteleone, G. (2020). Therapeutic Oligonucleotides for Patients with Inflammatory Bowel Diseases.. Biologics : targets & therapy, 14, 47-51. https://doi.org/10.2147/BTT.S257638",https://pubmed.ncbi.nlm.nih.gov/32606588/,"['Journal Article', 'Review']","['IBD', 'UC', 'CD']",False,True
39872845,Telocytes In Inflammatory Bowel Diseases: Contributions To Pathology And Therapeutic Potentials.,"telocytes, a novel mesenchymal cell population, are characterized by their distinctive long and slender projections known as telopodes and have garnered significant interest since their formal introduction to the literature in 2010. these cells have been identified in various tissues, including the gastrointestinal (gi) tract, where they are suggested to play important roles in maintaining structural integrity, immune modulation, and barrier function. inflammatory bowel diseases (ibd), which include crohn's disease (cd) and ulcerative colitis (uc), are characterized by chronic inflammation and fibrosis. while limited information is available on the fate of telocytes in this group of diseases, it has been suggested that loss/plasticity of telocytes can be among the key factors contributing to their pathogenesis. this review focuses on the current understanding of telocytes, their structural features, and their distribution within the gi tract under gut homeostasis and ibd. we also discuss the roles of these cells in immune regulation and intestinal repair. we highlight evidence implicating telocytes in the pathogenesis of ibd and other chronic inflammatory diseases that share similar pathophysiological processes with ibd. lastly, we discuss the current challenges in gut telocyte biology and the potential therapeutic implications of telocytes in ibd.",Panganiban RP; McAninch C; Chulkina M; Pinchuk IV,2024,Frontiers in cell and developmental biology,12,,1452258,10.3389/fcell.2024.1452258,"Panganiban, R. P., McAninch, C., Chulkina, M., & Pinchuk, I. V. (2024). Telocytes in inflammatory bowel diseases: contributions to pathology and therapeutic potentials.. Frontiers in cell and developmental biology, 12, 1452258. https://doi.org/10.3389/fcell.2024.1452258",https://pubmed.ncbi.nlm.nih.gov/39872845/,"['Journal Article', 'Review']","['IBD', 'UC', 'CD']",False,True
33214955,Role Of Substance P In The Pathophysiology Of Inflammatory Bowel Disease And Its Correlation With The Degree Of Inflammation.,"inflammatory bowel disease (ibd) is a multi-factorial, chronic inflammation of the gastrointestinal tract, containing ulcerative colitis (uc) and crohn's disease (cd). in uc, inflammation and sores are confined morphologically and microscopically to the mucosa, the innermost surface of the colon and the rectum. although, in cd, the infection is granulomatous and transmural, affecting the entire gastrointestinal tract from the mouth to the anus, with the skip area in-between. a neuropeptide, substance p (sp), which acts as a neurotransmitter and as a neuromodulator, plays a vital role in the brain-gut axis under stress. owing to the pro-inflammatory effects of sp, neuropeptide dysregulation induces inflammation in the intestine. there are variations in the distribution of substance p immunoreactive fibres in the various intestinal layers. the highest concentration of sp is in the mucosa and the lowest concentration in the lamina propria of the intestinal muscular membrane. reduced vasoactive intestinal peptide (vip) levels and elevated sp levels observed in the colonic mucosa of ibd by using immunohistochemistry and immunoassay. this literature review aims to find out the correlations between the level of substance p (sp) and disease activity. we conducted a literature review on ibd, sp, and we searched pubmed and google scholar for relevant articles in english. the result of the study supports a positive relationship between the level of substance p (sp) and disease activity, with increased concentration of substance p in the colon and rectum of cd and uc patients. it is concluded that patients with active cd, along with inflammatory changes, had elevated plasma sp levels and immunoreactivity of sp in the colon than those seen in control and inactive cases. these alterations are more prevalent in ulcerative colitis than crohn's disease and are more prevalent in the moderately infected area than the least affected area of the intestine.",Patel M; Valaiyaduppu Subas S; Ghani MR; Busa V; Dardeir A; Marudhai S; Cancarevic I,2020,Cureus,12,10,e11027,10.7759/cureus.11027,"Patel, M., Valaiyaduppu Subas, S., Ghani, M. R., Busa, V., Dardeir, A., Marudhai, S., & Cancarevic, I. (2020). Role of Substance P in the Pathophysiology of Inflammatory Bowel Disease and Its Correlation With the Degree of Inflammation.. Cureus, 12(10), e11027. https://doi.org/10.7759/cureus.11027",https://pubmed.ncbi.nlm.nih.gov/33214955/,"['Journal Article', 'Review']","['IBD', 'UC', 'CD']",False,True
