38585636,Probiotics For Inflammatory Bowel Disease: Is There Sufficient Evidence?,"inflammatory bowel disease (ibd) refers to chronic inflammatory disorders of the gut. ulcerative colitis (uc) and crohn's disease (cd) are two subtypes of ibd. evidence suggests that the intestinal microbiota plays a role in the pathogenesis of ibd, so probiotics have garnered a lot of interest as a potential treatment or prevention for ibd. however, clinical evidence of the efficacy of probiotics is still debatable. we performed a literature review. an advanced search considered clinical studies on probiotic for ibd from inception to 2023 in pubmed, embase, cochrane library, and web of science. in the treatment of uc with probiotics, only escherichia coli nissle 1917 for maintenance treatment of uc in remission, and bifidobacterium and vsl#3 for induction of remission in patients with mild to moderately active uc have shown strong evidence. currently, there are no definitive conclusions regarding the effectiveness of probiotics in cd. the mechanism of probiotic treatment for ibd may be related to reducing oxidative stress, repairing the intestinal barrier, regulating intestinal flora balance, and modulating intestinal immune response. differences in the benefits of probiotics between cd and uc may be attributable to the different lesion extent and immune-mediated pathophysiology. more robust randomized clinical trials are required to validate the efficacy and safety of diverse probiotic strains in ibd.",Ma Y; Yang D; Huang J; Liu K; Liu H; Wu H; Bao C,2024,Open life sciences,19,1,20220821,10.1515/biol-2022-0821,"Ma, Y., Yang, D., Huang, J., Liu, K., Liu, H., Wu, H., & Bao, C. (2024). Probiotics for inflammatory bowel disease: Is there sufficient evidence?. Open life sciences, 19(1), 20220821. https://doi.org/10.1515/biol-2022-0821",https://pubmed.ncbi.nlm.nih.gov/38585636/,"['Journal Article', 'Review']","['IBD', 'UC', 'CD']",False,True
32959603,Extraintestinal Manifestations Of Inflammatory Bowel Disease In Middle Eastern Patients.,"background and aims: the inflammatory bowel diseases (ibds), crohn's disease (cd) and ulcerative colitis (uc), are gastrointestinal autoimmune disorders with many extraintestinal manifestations (eims). previously reported incidences of eims in ibd patients have ranged from 10% to 50%. the large variation in occurrence of eims has been linked to genetic predisposition. correlations between individual eims are unclear. therefore, we aim to estimate the incidence of eims in a middle eastern cohort of patients with ibd and examine possible relationships with eims.
patients and methods: we conducted a retrospective study involving all patients included in the king abdulaziz university ibd information system registry between 2013 and 2018. data on demographics, disease characteristics, and eims were extracted and analyzed using descriptive statistics: the standard student's t-test and chi-squared test. logistic regression analysis was used to examine associations using stata software version 11.2 (statacorp, tx, usa).
results: we reviewed the electronic medical files of 284 patients with confirmed ibd, of which 158 (55.6%) were females, the mean age was 27.8 (±15) years; 146 (51.4%) patients had cd and 138 (48.6%) uc. the overall incidence risk of eims was 138 (52.3%) over a mean duration of follow up of 7.3 (±3.9) years. the most common eim was arthritis (33%), followed by aphthous ulcers (16%). pyoderma gangrenosum occurred in 8% of patients and appeared to be specific for cd patients (p = 0.002), whereas primary sclerosing cholangitis (psc) was more specific for uc (p = 0.001). certain eims appeared to occur together such as arthritis with psc (p = 0.001). regression analysis identified disease type (in favor of uc; odds ratio = 0.50, p = 0.03) and age at the time of diagnosis (odds ratio = 1.04, p = 0.001) as the only significant predictors of eims.
conclusion: our results demonstrate that more than half of ibd patients have at least one eim. contrary to what has often been reported, we found that eims occur more commonly in uc than cd. a multidisciplinary assessment is recommended as part of ibd management to improve overall health outcomes.",Adam H; Alqassas M; Saadah OI; Mosli M,2020,Journal of epidemiology and global health,10,4,298-303,10.2991/jegh.k.200330.001,"Adam, H., Alqassas, M., Saadah, O. I., & Mosli, M. (2020). Extraintestinal Manifestations of Inflammatory Bowel Disease in Middle Eastern Patients.. Journal of epidemiology and global health, 10(4), 298-303. https://doi.org/10.2991/jegh.k.200330.001",https://pubmed.ncbi.nlm.nih.gov/32959603/,"['Journal Article', ""Research Support, Non-U.S. Gov't"", 'Review']","['IBD', 'UC', 'CD']",False,True
32335670,Relapse From Deep Remission After Therapeutic De-Escalation In Inflammatory Bowel Disease: A Systematic Review And Meta-Analysis.,"background and aims: we conducted a systematic review and meta-analysis evaluating the relapse rate after therapeutic de-escalation in inflammatory bowel disease [ibd] patients who achieved deep remission [dr].
methods: we searched medline, embase, and major gastroenterology conferences up to july 2019 for studies reporting relapse in adult patients with dr who subsequently underwent therapeutic de-escalation. eligible studies defined dr as at least a combination of clinical remission and mucosal healing/endoscopic remission. the primary outcome was cumulative 1-year and 2-year relapse rates after therapeutic de-escalation. secondary outcomes were relapse rates in ulcerative colitis [uc] and crohn's disease [cd], relapse after anti-tumour necrosis factor-α [anti-tnfα] de-escalation, and the rate of disease response recapture following re-escalation.
results: thirteen studies encompassing 837 patients were identified. the cumulative relapse rate after therapeutic de-escalation was 28.7% within 1 year [12 studies], and 38.4% within 2 years [eight studies]. relapse rates within 1 year and 2 years were comparable between uc [five studies; 25.4% and 37.4%] and cd [seven studies; 34.1% and 39.9%]. ten studies reported de-escalation of anti-tnfα, of which 29.8% patients relapsed within 1 year and 41.4% within 2 years. response recapture following re-escalation [eight studies] was 75.4%.
conclusions: despite achieving deep remission, therapeutic de-escalation in this patient population is associated with significant relapse risk within 1 year and 2 years. this risk is more pronounced in patients requiring anti-tnfα for management, likely because of more severe disease. similar rates of relapse were reported among uc and cd within these time periods. these findings suggest that combined clinical and endoscopic remission should not be an impetus to consider therapeutic de-escalation.",Zhang B; Gulati A; Alipour O; Shao L,2020,Journal of Crohn's & colitis,14,10,1413-1423,10.1093/ecco-jcc/jjaa087,"Zhang, B., Gulati, A., Alipour, O., & Shao, L. (2020). Relapse From Deep Remission After Therapeutic De-escalation in Inflammatory Bowel Disease: A Systematic Review and Meta-analysis.. Journal of Crohn's & colitis, 14(10), 1413-1423. https://doi.org/10.1093/ecco-jcc/jjaa087",https://pubmed.ncbi.nlm.nih.gov/32335670/,"['Journal Article', 'Meta-Analysis', 'Systematic Review']","['IBD', 'UC', 'CD']",False,True
36232412,The Gut-Immune-Brain Axis: An Important Route For Neuropsychiatric Morbidity In Inflammatory Bowel Disease.,"inflammatory bowel disease (ibd) comprises crohn's disease (cd) and ulcerative colitis (uc) and is associated with neuropsychiatric symptoms like anxiety and depression. both conditions strongly worsen ibd disease burden. in the present review, we summarize the current understanding of the pathogenesis of depression and anxiety in ibd. we present a stepwise cascade along a gut-immune-brain axis initiated by evasion of chronic intestinal inflammation to pass the epithelial and vascular barrier in the gut and cause systemic inflammation. we then summarize different anatomical transmission routes of gut-derived peripheral inflammation into the central nervous system (cns) and highlight the current knowledge on neuroinflammatory changes in the cns of preclinical ibd mouse models with a focus on microglia, the brain-resident macrophages. subsequently, we discuss how neuroinflammation in ibd can alter neuronal circuitry to trigger symptoms like depression and anxiety. finally, the role of intestinal microbiota in the gut-immune-brain axis in ibd will be reviewed. a more comprehensive understanding of the interaction between the gastrointestinal tract, the immune system and the cns accounting for the similarities and differences between uc and cd will pave the path for improved prediction and treatment of neuropsychiatric comorbidities in ibd and other inflammatory diseases.",Masanetz RK; Winkler J; Winner B; Günther C; Süß P,2022,International journal of molecular sciences,23,19,,10.3390/ijms231911111,"Masanetz, R. K., Winkler, J., Winner, B., Günther, C., & Süß, P. (2022). The Gut-Immune-Brain Axis: An Important Route for Neuropsychiatric Morbidity in Inflammatory Bowel Disease.. International journal of molecular sciences, 23(19). https://doi.org/10.3390/ijms231911111",https://pubmed.ncbi.nlm.nih.gov/36232412/,"['Journal Article', 'Review']","['IBD', 'UC', 'CD']",False,True
36158031,Apheresis: A Cell-Based Therapeutic Tool For The Inflammatory Bowel Disease.,"inflammatory bowel disease (ibd) is a hallmark of leukocyte infiltration, followed by the release of cytokines and interleukins. disease progression to ulcerative colitis (uc) or crohn's disease (cd) remained largely incurable. the genetic and environmental factors disrupt enteral bacteria in the gut, which hampers the intestinal repairing capability of damaged mucosa. commonly practiced pharmacological therapies include 5-aminosalicylic acid with corticosteroids and tumor necrosis factor (tnf)-α. new interventions such as cdp571 and tnf-blocking rdp58 report the loss of patient response. this review discusses the non-pharmacologic selective granulocyte-monocyte-apheresis (gma) and leukocytapheresis (lcap) that have been proposed as treatment modalities that reduce mortality. gma, an extracorporeal vein-to-vein technique, presents a strong safety profile case for its use as a viable therapeutic option compared to gma's conventional medication safety profile. gma reported minimal to no side effects in the pediatric population and pregnant women. numerous studies report the efficacious nature of gma in uc patients, whereas data on cd patients is insufficient. its benefits outweigh the risks and are emerging as a favored non-pharmacological treatment option. on the contrary, lcap uses a general extracorporeal treatment that entraps leukocytes and suppresses cytokine release. it has been deemed more efficacious than conventional drug treatments, the former causing better disease remission, and maintenance. patients with uc/cd secondary to complications have responded well to the treatment. side effects of the procedure have remained mild to moderate, and there is little evidence of any severe adverse event occurring in most age groups. lcap decreases the dependence on steroids and immunosuppressive therapies for ibd. the review will discuss the role of gma and lcap.",Yasmin F; Najeeb H; Naeem U; Moeed A; Koritala T; Surani S,2022,World journal of clinical cases,10,21,7195-7208,10.12998/wjcc.v10.i21.7195,"Yasmin, F., Najeeb, H., Naeem, U., Moeed, A., Koritala, T., & Surani, S. (2022). Apheresis: A cell-based therapeutic tool for the inflammatory bowel disease.. World journal of clinical cases, 10(21), 7195-7208. https://doi.org/10.12998/wjcc.v10.i21.7195",https://pubmed.ncbi.nlm.nih.gov/36158031/,"['Journal Article', 'Review']","['IBD', 'UC', 'CD']",False,True
32452591,Review Article: Withdrawal Of 5-Aminosalicylates In Inflammatory Bowel Disease.,"background: 5-aminosalicylates (5-asa) are widely used in inflammatory bowel disease (ibd), but emerging evidence suggests that they may be safely withdrawn in significant subsets of patients. this is important to address: 5-asa therapy accounts for up to 25% of total healthcare costs in ulcerative colitis (uc), while almost a third of patients with crohn's disease (cd) receive long-term 5-asa despite no clear evidence of benefit. further, rationalising medication burden may improve overall adherence and outcome.
aims: to summarise the rationale for 5-asa withdrawal, review the current evidence in both uc and cd and consider the data surrounding colorectal cancer (crc) prevention, guiding an evidence-based withdrawal strategy.
methods: pubmed was searched to identify relevant studies. only papers published in english were reviewed, with priority given to randomised clinical trials and meta-analyses.
results: for patients with uc, consideration of 5-asa withdrawal should be made on a case-by-case basis, but it appears safest for those in deep remission without any of the following risk factors: younger age (<40 years), remission for less than 2 years, a history of multiple flares, extensive disease. 5-asa withdrawal should also be considered in patients with uc escalated to biologic therapy who have achieved remission and in all patients with cd. although 5-asa therapy may have chemopreventive benefits for crc, the cost-benefit ratio appears significant, and this indication is not justified by evidence in those who have achieved remission and are continuing therapy with other agents, or in those in sustained remission without a history of extensive disease.
conclusions: although the majority of patients with ibd receive 5-asa during their disease course, safe withdrawal appears possible in many, with important implications for both health economics and patient experience. a number of unanswered questions, however, remain.",Chapman TP; Frias Gomes C; Louis E; Colombel JF; Satsangi J,2020,Alimentary pharmacology & therapeutics,52,1,73-84,10.1111/apt.15771,"Chapman, T. P., Frias Gomes, C., Louis, E., Colombel, J. F., & Satsangi, J. (2020). Review article: withdrawal of 5-aminosalicylates in inflammatory bowel disease.. Alimentary pharmacology & therapeutics, 52(1), 73-84. https://doi.org/10.1111/apt.15771",https://pubmed.ncbi.nlm.nih.gov/32452591/,"['Journal Article', 'Review']","['IBD', 'UC', 'CD']",False,True
34199428,"Probiotics, Prebiotics And Synbiotics In Inflammatory Bowel Diseases.","inflammatory bowel diseases (ibd), which include crohn's disease (cd) and ulcerative colitis (uc), are chronic inflammatory diseases of the digestive tract with periods of remission and relapses. the etiopathogenesis of ibd is multifactorial and has not been fully understood. hence, only symptomatic treatment of these diseases is possible. the current pharmacological treatment has variable efficacy and is associated with the risk of significant side effects. therefore, there is a constant need to search for new types of therapies with a high safety profile. considering that the qualitative and quantitative profile of the gastrointestinal microbiome is often different in patients with ibd than in healthy individuals, there is a need for looking for therapies aimed at restoring intestinal microbiome homeostasis. thus, the use of strictly defined probiotics, prebiotics and synbiotics may become an alternative form of ibd therapy. there is evidence that treatment with certain probiotic strains, e.g., vsl#3 and escherischia coli nissle 1917, is an effective form of therapy to induce remission in patients with mild to moderate uc. so far, the effectiveness of the use of probiotics, prebiotics and synbiotics in inducing or maintaining remission in patients with cd has not been confirmed. there are also reports of possible beneficial effects of fecal microbiota transplantation (fmt) on the course of ibd, especially uc. further, well-planned studies on a large group of patients are needed to determine the role of specific probiotic strains, prebiotics, synbiotics and fmt in the treatment of ibd in adults and in children.",Akutko K; Stawarski A,2021,Journal of clinical medicine,10,11,,10.3390/jcm10112466,"Akutko, K., & Stawarski, A. (2021). Probiotics, Prebiotics and Synbiotics in Inflammatory Bowel Diseases.. Journal of clinical medicine, 10(11). https://doi.org/10.3390/jcm10112466",https://pubmed.ncbi.nlm.nih.gov/34199428/,"['Journal Article', 'Review']","['IBD', 'UC', 'CD']",False,True
34203609,Highlighting The Relevance Of Gut Microbiota Manipulation In Inflammatory Bowel Disease.,"two different conditions are included in inflammatory bowel disease (ibd), crohn's disease (cd) and ulcerative colitis (uc), being distinguished by chronic recurrence of gut inflammation in persons that are genetically predisposed and subjected to environmental causative factors. the normal structure of the gut microbiome and its alterations in ibd were defined in several microbial studies. an important factor in the prolonged inflammatory process in ibd is the impaired microbiome or ""dysbiosis"". thus, gut microbiome management is likely to be an objective in ibd treatment. in this review, we analyzed the existing data regarding the pathophysiological/therapeutic implications of intestinal microflora in the development and evolution of ibd. furthermore, the main effects generated by the administration of probiotics, prebiotics, fecal transplantation, and phytochemicals supplementation were analyzed regarding their potential roles in improving the clinical and biochemical status of patients suffering from crohn's disease (cd) and ulcerative colitis (uc), and are depicted in the sections/subsections of the present paper. data from the literature give evidence in support of probiotic and prebiotic therapy, showing effects such as improving remission rate, improving macroscopic and microscopic aspects of ibd, reducing the pro-inflammatory cytokines and interleukins, and improving the disease activity index. therefore, the additional benefits of these therapies should not be ignored as adjuvants to medical therapy.",Pavel FM; Vesa CM; Gheorghe G; Diaconu CC; Stoicescu M; Munteanu MA; Babes EE; Tit DM; Toma MM; Bungau S,2021,"Diagnostics (Basel, Switzerland)",11,6,,10.3390/diagnostics11061090,"Pavel, F. M., Vesa, C. M., Gheorghe, G., Diaconu, C. C., Stoicescu, M., Munteanu, M. A., Babes, E. E., Tit, D. M., Toma, M. M., & Bungau, S. (2021). Highlighting the Relevance of Gut Microbiota Manipulation in Inflammatory Bowel Disease.. Diagnostics (Basel, Switzerland), 11(6). https://doi.org/10.3390/diagnostics11061090",https://pubmed.ncbi.nlm.nih.gov/34203609/,"['Journal Article', 'Review']","['IBD', 'UC', 'CD']",False,True
34307315,Artificial Intelligence Enhances Studies On Inflammatory Bowel Disease.,"inflammatory bowel disease (ibd), which includes ulcerative colitis (uc) and crohn's disease (cd), is an idiopathic condition related to a dysregulated immune response to commensal intestinal microflora in a genetically susceptible host. as a global disease, the morbidity of ibd reached a rate of 84.3 per 100,000 persons and reflected a continued gradual upward trajectory. the medical cost of ibd is also notably extremely high. for example, in europe, it has €3,500 in cd and €2,000 in uc per patient per year, respectively. in addition, taking into account the work productivity loss and the reduced quality of life, the indirect costs are incalculable. in modern times, the diagnosis of ibd is still a subjective judgment based on laboratory tests and medical images. its early diagnosis and intervention is therefore a challenging goal and also the key to control its progression. artificial intelligence (ai)-assisted diagnosis and prognosis prediction has proven effective in many fields including gastroenterology. in this study, support vector machines were utilized to distinguish the significant features in ibd. as a result, the reliability of ibd diagnosis due to its impressive performance in classifying and addressing region problems was improved. convolutional neural networks are advanced image processing algorithms that are currently in existence. digestive endoscopic images can therefore be better understood by automatically detecting and classifying lesions. this study aims to summarize ai application in the area of ibd, objectively evaluate the performance of these methods, and ultimately understand the algorithm-dataset combination in the studies.",Chen G; Shen J,2021,Frontiers in bioengineering and biotechnology,9,,635764,10.3389/fbioe.2021.635764,"Chen, G., & Shen, J. (2021). Artificial Intelligence Enhances Studies on Inflammatory Bowel Disease.. Frontiers in bioengineering and biotechnology, 9, 635764. https://doi.org/10.3389/fbioe.2021.635764",https://pubmed.ncbi.nlm.nih.gov/34307315/,"['Journal Article', 'Review']","['IBD', 'UC', 'CD']",False,True
36768556,Mirna Molecules-Late Breaking Treatment For Inflammatory Bowel Diseases?,"micrornas (mirnas) are a group of non-coding rnas that play a critical role in regulating epigenetic mechanisms in inflammation-related diseases. inflammatory bowel diseases (ibds), which primarily include ulcerative colitis (uc) and crohn's disease (cd), are characterized by chronic recurrent inflammation of intestinal tissues. due to the multifactorial etiology of these diseases, the development of innovative treatment strategies that can effectively maintain remission and alleviate disease symptoms is a major challenge. in recent years, evidence for the regulatory role of mirnas in the pathogenetic mechanisms of various diseases, including ibd, has been accumulating. in light of these findings, mirnas represent potential innovative candidates for therapeutic application in ibd. in this review, we discuss recent findings on the role of mirnas in regulating inflammatory responses, maintaining intestinal barrier integrity, and developing fibrosis in clinical and experimental ibd. the focus is on the existing literature, indicating potential therapeutic application of mirnas in both preclinical experimental ibd models and translational data in the context of clinical ibd. to date, a large and diverse data set, which is growing rapidly, supports the potential use of mirna-based therapies in clinical practice, although many questions remain unanswered.",Aggeletopoulou I; Mouzaki A; Thomopoulos K; Triantos C,2023,International journal of molecular sciences,24,3,,10.3390/ijms24032233,"Aggeletopoulou, I., Mouzaki, A., Thomopoulos, K., & Triantos, C. (2023). miRNA Molecules-Late Breaking Treatment for Inflammatory Bowel Diseases?. International journal of molecular sciences, 24(3). https://doi.org/10.3390/ijms24032233",https://pubmed.ncbi.nlm.nih.gov/36768556/,"['Journal Article', 'Review']","['IBD', 'UC', 'CD']",False,True
33010406,Treat To Target: The Role Of Histologic Healing In Inflammatory Bowel Diseases: A Systematic Review And Meta-Analysis.,"background: endoscopic remission is a recognized therapeutic endpoint in inflammatory bowel disease (ibd; crohn's disease (cd), ulcerative colitis (uc)). the impact of persistent histologic activity on long-term outcomes is less clear and limited by small studies.
methods: we performed a systematic search of pubmed and embase to identify eligible studies examining the association between histologic activity and relapse in patients with cd or uc in endoscopic remission. studies were pooled together using random effects meta-analysis per the dersimonian and laird inverse variance method. the impact of different histologic scales, cut-offs, and individual features were examined.
findings: our meta-analysis included 28 studies contributing 2,806 patients (2677 uc; 129 cd). in uc, histologically active disease was associated with an overall increased risk of relapse (or, 2.41; 95% ci, 1.91-3.04), with a similar effect noted in the subgroup with endoscopic mayo endoscopic score of 0 vs 0 or 1. more rigorous geboes cut-offs demonstrated numerically stronger impact on relapse rates-geboes <3.1 (or, 2.40; 95% ci, 1.57-3.65), geboes <2.1 (or, 3.91; 95% ci, 2.21-6.91) and geboes 0 (or, 7.40; 95% ci, 2.00-18.27). among individual histologic features, basal plasmacytosis (or, 1.94), neutrophilic infiltrations (or, 2.30), mucin depletion (or, 2.05), and crypt architectural irregularities (or, 2.22) predicted relapse. there was no association between histologic activity and relapse in cd.
conclusions: in patients with uc in endoscopic remission, persistent histologic activity is associated with higher rates of relapse. greater degree of normalization may have a stronger impact.",Gupta A; Yu A; Peyrin-Biroulet L; Ananthakrishnan AN,2021,Clinical gastroenterology and hepatology : the official clinical practice journal of the American Gastroenterological Association,19,9,1800-1813.e4,10.1016/j.cgh.2020.09.046,"Gupta, A., Yu, A., Peyrin-Biroulet, L., & Ananthakrishnan, A. N. (2021). Treat to Target: The Role of Histologic Healing in Inflammatory Bowel Diseases: A Systematic Review and Meta-analysis.. Clinical gastroenterology and hepatology : the official clinical practice journal of the American Gastroenterological Association, 19(9), 1800-1813.e4. https://doi.org/10.1016/j.cgh.2020.09.046",https://pubmed.ncbi.nlm.nih.gov/33010406/,"['Journal Article', 'Meta-Analysis', ""Research Support, Non-U.S. Gov't"", 'Systematic Review']","['IBD', 'UC', 'CD']",False,True
